,name,addr,grade,review
135,태릉양꼬치양갈비,서울 노원구 공릉로 110 1층,4.4,짜장 간짜장 양파 듬뿍 재료 듬뿍      다른 곳도 여기 최고    양 꼬치 안남 요리 칠리 새우 유린 기 도 맛있음 
136,백두한우곱창전문 노원점,서울 노원구 상계로 92,3.2,간만 별   개 양 꼬치 집 발견 고기 부드럽고 하나 안남 바로 우도 맛있고 담 온면 예정  주변 곱창 집 최근 후기 좋은 곳 진짜 유명한 곱창 집 들 다 여기   위 도대체 왜 안 유명한지 밑 후기 들 진짜 공감 내용    곱 많이 고소하고 대창 진짜 최고 구 요즘 다른 가게 생 간 비려 못 진짜 싱싱하고 고소하고 오랜 만 생 간 너무 맛있게    사장 님 엄청 친절하세요 맞은편 곱창 집 사람 많아서 상대 적 장사 안되는 것 같은데 꼭 다른 가게 들 그램 수도 많아요 이제 곱창 멀리 안 좋아요 번창  곱창 안 곱 많고 기름 많이 안 조리 깔끔하고 맛있게 특히 생 간 갓 주신 건 아직도 너무 맛있는 것     개인 적 대창 막창 염통 볶음밥 추천 
137,공릉회수산,서울 노원구 공릉로 179 2층,3.4,여기 진짜 맛있어요 다 번만    앞집 우연히 가겐 데 왜 사람 없는지 여태 소 곱창 중 제일 맛있었고 그리고 볶음밥 맛있어요 어떤 양념장 같이 극락 아주 머 님 친절하시고 꼭 꼭  우리 먼저 온 사람 들 아무 말 안 예약 단체 손님 있다고 계속 눈치 얼른 달라 몇번 재촉 함 회 가시 몇 개 분위기 산만함                                     
138,디저트식탁,서울 노원구 상계로1길 14-29 2층,4.0,    분위기 좋고 케이크 맛있고 시간 떼 우기 좋습니다 의자 좀 불편해요 타 지역 친구 지인 들 좋음  말차 갸또 맛있었고 마들렌 플 은 무난 
139,페페그라노,서울 노원구 공릉로32길 5 1층,3.8,케이크 기본         만 오래된 시트 퍽퍽해 대량생산 프랜차이즈 케이크 비교 수준 프랜차이즈 케이크 생각 그리고 까눌레 휘 낭시 쇼케이스 비닐 포장 등 방법 외부 먼지 차단 안 해 강아지 있는데 차단 안 댕댕 이 귀여운거랑 털 위생 별개 가격 만 퀄리티 아님 재 방문 의사 없음  라자냐 맛있쪙  후기 안 심각하게 거의 다 웨이 팅할 아니에요    
140,라무야끼,서울 노원구 석계로3길 15-1,3.6,가격 대 좀 있지만 이 근처 괜찮은 양식 좀 짭짤한데 맛있어요 특별한 날 오기 좋을듯       시 전에 입성    프로 할인 이벤트 맛 양 갈비 시작 자주 곳 상봉 점 익숙한 석 계점 고 기도 맛 분위기 직원 분 응대 다 만족합니다 더울까 걱정 엄청 시원하고 좋네요 다만 음악 소리 금   
141,암사골숯불닭갈비,서울 노원구 공릉로 101 1층,4.9,밑 분 들 피크타임 때 가요 저 평일 네 시반 오픈 시간   인 화로 두 개 알바생 갈비 리필 여 사장 님 처음 고기 법 시간 조금 초과 이해해 만족 화장실 깔끔하구요 가게 바 테이블 단체 힘들고 네 명 이하 예약 추천      인생 숯불 닭갈비 집 맛있고 친절하고 깨끗하고 저렴하고 혼자 다해 너무 맛있어서 번창 맘 후기 닭갈비 다 바로 편해요 간장 소금 맛있구 막국수 평타 이상 같이 떡 바삭       
142,거북이삼겹살,서울 노원구 덕릉로 721 정진아트리움 107 108호,4.6,맛집 입니다   인분 씩 주문 좋구 전 양념 기본 간장 좋아요 같이 간 지인 양념 좋다고 거 취향 차이 같으니 골고루 막국수 시원하고 맛있어요 사장 님 친절 달 두 번 꼭 것 같아요  동네  등 삼겹살     
143,스타벅스 노원KT점,서울 노원구 노해로 502,3.9,삼겹살 때 가요 맛있어요      스프 맛있어요 
