,name,addr,grade,review
68,영수네감자국,서울 도봉구 도봉로181길 86,4.2,도봉산 아래 감자 국 근 본집 콩 비지 쑥갓 육수 행복 행복 어디 있는 것               맛있음 굿 
69,문어주,서울 도봉구 도봉로133길 41 1층 106,107호,           
70,홍가네풍천장어,서울 도봉구 방학로 290-7,3.4,시끄럽다 직원 시끄러운 테이블 주의 좀 좋겠다고 하니 형식 적 말 뿐 더 시끄럽게 해도 나 라라 다 싸움 날 뻔했다 친절 말 아니라 손님 불편 해소 건데 술 큰소리 손님 매상 더 중요한가 맛 그냥 저 가성 글쎄  장어 막 때 좀 고무 것 같이 매우 질겨 처음 뭐 여러 집 장어 많이 이런 식 처음 멸치 국수 멸치 향 없고 밍밍 함 그나마 곤 네 밥 함 사장 님 말투 좀 그랬고 우리   명 이서 다 재 방문 의사 전혀 없다고 함     
71,참만두,서울 도봉구 창동 23-4,4.3, 천원 만두 꽉 찬 만두   개 만두 일 오래 것 같음에도 늘 만두 게 재밌고 즐거워 보이 웃음 저 일 것 있어서 인상 열심히 생각  맛있다 저렴하다 친절하시다  문자 예약 김치 만두   고기만   김치 만두 색 엄청 빨간데 저 한텐 안 적당했어요 고기만 양배추 맛 많이 나요    맛있네요 양도 많고 너무 만족 다음   팩 아주머니 친절 
72,하누소 창동본점,서울 도봉구 노해로 327 5층,2.2,맛 가성 최고 입니다 매운데 단맛 살짝 있어서 좋습니다 밀떡 쫀득 맛있어요 양 볶음밥 추천 다만 사장 님 가끔 까칠하실 때 있어요  가성 비 최고 까칠한 사장 님 덤 표현 그런듯 마음 뜻  적당히 맛 좋은데 특별한 뭔가 없어 아쉽다 
73,동적불고기&깡통구이 쌍문점,서울 도봉구 도봉로109길 30 1층,4.5,고 기 상태 밑반찬 좋지만 가격 좀 부담 해 고기 판이 바베큐 형식 판이 고기 구 우시 추천 처음   차 초벌 때 직원 분 주시   차 직접 야해요 저 어려운 고 기 판이 굽기 어려웠어요 고 기 맛 좋으나 자주 못 같아요 매장 좁아 테이블 끼리 바로 옆일 정도 좁아요 얼그레이 하이 볼 치즈 계란 찜 맛있어요   명 쌍문역 가까이 해  맛 있지만 가격 내부 아쉽  둘이서  만원 고기 집 맛 좀 아쉬웠습니다 
74,대문,서울 도봉구 시루봉로 139-6,3.6,진짜 맛집 이    돈까스 두 툼 전혀 퍽퍽 하 뜸      여기 존맛 두 번 세번 여러 번 가라     
75,무수옥,서울 도봉구 도봉로165길 15,3.2,  점수 기준 표   동네 기준   개 일부러 간다   개 맛있다 자주 만하   개 적당히 때 한번 씩 간다   개 재 방문 그닥   개 이 음식 컵라면 팟뽕 커리 괜찮은데 쌀국수 아 음 국수 땜   점 동네 허름 가게 좀 비싼듯  쏨땀 맛있었어요 쏨땀 첨 맛있네요 매콤 꼬릿 고소 담 고수 좀 더 좀 비싸긴한데 주변 쏨땀 곳 없어서 자주 같 애 여름 더 맛있을 듯 근데 팟타이 그냥 그랬어요 마트 소스 집 해먹 거 비슷한 맛 요  우와 대박 한국 젤로 맛나 태국 음식점 태국 때 꼭 
76,쌍문동판다쓰,서울 도봉구 우이천로24길 49 1층,4.1,좀  가성 비 굿  거의 모든 메뉴 다 다 맛있어요   쌍문 최고 맛집 입니다 주말 점심시간 웨이 팅 필수 저녁 와인 도 좋아요 사장 님 직원 분들 너무 친절하셔서 항상 기분 좋게 식사 오는 곳 이 
77,동해수산,서울 도봉구 도봉로 663-8,3.8,생각 가격 대비 영 아님 설렁탕 특 도가니 다섯 조각 가격 업 뇌피셜 설렁탕 국물 진국 아닌 뭔가 첨가 한 듯 깍 뚜 기와 김치 보통 서비스 정말 엉망    점수 기준 표   동네 기준   개 맛있다 자주 만하   개 특정 메뉴 여기 정도 갠   개 뭐 그냥 저 함   개 재 방문 그닥   개 이 음식 컵라면 무난 깔끔함 야근 때 한 그릇 뚝딱 좋음 특 도가니 깍두기 존맛임  맛     서비스     양     다른 식당 들 만두 가격 보통   개     원 이지만 이 곳 특별히   개     원 에 제공 확실히 가성 비 있었다 그러나 덥고 습해서인지 직원 분들 기분 안좋아 그걸 왜 굳이 손님 표 
78,수정궁,서울 도봉구 방학로 173,3.6,    해물 쟁반 짜장 눈꽃 탕수육 맛잇엇음 옛날  후기 많아 기대하고 짜장면 싱거운 밍밍 맛 별로 없었어요 중 새우 같이 채소 양 너무 재 방문 의사 없습니다 
79,메이다이닝,서울 도봉구 도봉로169길 202,3.4,서빙 직원 들 진짜 불친절  두번째 괜찮아요 친절하고요 맛있게  맛있지만 이렇게 더운 여름날 문 다 정말 너무 더워서 먹기 힘들었어요 
80,옹기꽃게장,서울 도봉구 도봉산4가길 14-9 1층,3.3,엄청 깔끔함 야채 단맛 은은하게 해물 맛 과 잘 문어 살짝 테이블 가위 문제   아래 리뷰 불친절하다고 내 때 친절했음 비쌈 예전     원 었는데 지금      원 임 근데 맛 단점 보완 함 맛있음 내 봄 짬뽕 중 탑   안  개업 때 짬봉 맛집 근래 짬봉 야채 양파 전부 더라구요 짬봉 한 그릇 문어 떡하니 거 너무 볼품 식 별로 짬봉 그릇 바 기존 그릇 사장 님 야채 왜케 없냐고 국물 신경 단가 라며 말 짬봉 면 같이 아 삭 야채 좌우 다 고 생각 사람  천원 으로 시작 오백원 지금      원 으로 차마  천원 대로는 못 생각 재료 개업 때 맛 유지 마음 입니다 아쉬워요 이제 윤짬봉가서 짬봉 안 구  맛 불친절함 
81,삼오집,서울 도봉구 도봉로165길 4,3.2,포장 안되고 배달 이유 뭘  국물 맛 요  짬뽕 전문점 너무 아쉬운 맛    해물짬뽕 집 해물 대한 리뷰 너무 안 좋길래 차돌 짬뽕 차돌 짬뽕 그렇게 맛있진 그냥 저 만 함 그래서 별   개 굳이 또 일단 차돌 짬뽕 고기 거 국물 시원하지 좀 걸쭉함 맛집 가기 아깝 짬뽕 짜장면 훨씬 가격  천원 이라 가성 비도 갑     짬뽕 맛 가격 좀 있음 
82,도봉관,서울 도봉구 노해로 261 1층,,직접 육수 짬뽕 진짜 드문 집 짬뽕 미리 바로바로 줌 채소 불맛 이상한 거 정직한 집 항상 깨끗하고 친절한 집 입니다 탕슉 맛 요  독특한 국물 맛 다만 예전 재료 좀 부실해진 느낌     
83,소도둑 도봉동점,서울 도봉구 도봉로 909 1층,4.0,        나 맛집 사장 님 너무 친절 단골 추가 내용 만 맛집 어느덧 모두 알 맛집 현재 사진 다르게 테이블 천막 등 많은것 
84,스시혼 창동점,서울 도봉구 도봉로110길 8,3.3,신선한 재료 수제 버거 고기 패티 후추 조금 과 느낌 오랜 만 재 방문 맛 좀 느낌 더 맛있어져서   점  수제 버거 맛 기준 집 뜨끈하고 부드러운 패티 깊고 풍부한 감칠맛 육즙 뚝뚝 스타일 멀어서 아쉽다 본점 쌍문동 듯 한데 거기 감 마트 표 냉동 감 흠  아보카도 버거 맛있어요 
85,마쯔무라돈까스 본점,서울 도봉구 노해로63길 84 지하1층,4.3,빙 아줌마 분 친절하고 칼국수 머리카락 두 번 안 이름 최고 칼국수 손님 대 써비스 별 루임 별하나 아까워요  해물찜 만해 물김치 좋은데 겉절이 좋아요 그런데 바지락 칼국수 해감 이 덜   명 같이   명 다 모래 다한 거 아닌가요  바지락 풍 성히 준 국수 맛있게 내부 화장실 냄새 심한것이 아쉽네요 화장실 먼저 사용 식사 계속 냄새 식사 질 남성 입 식 소변기 좀 자주 세척 필요 있어 재 방문   
86,묵은지사랑,서울 도봉구 도봉로164길 38,4.3,도봉산 하산 길 양도 많고 맛   재 방문 의사 있음 강추      푸근한 인상 남자 사장 님 깔끔한 손맛 여자 사장 님 저렴하고 맛 곳 
87,덩어리 창동점,서울 도봉구 노해로63길 79,4.0,돼지고기 최고 존엄 맛집         
88,즐거운술상,서울 도봉구 노해로 341,3.5,고민 방문 사진 외 작은 멍게   개 꼬막    개 정도 떡볶이 샌드위치 사라다 풍 의 샐러드 두부 조림 과메기 아주 조금   인  만원   명 이서   만원 길 기분 단 품팔 때 좋았음 음식 밀어내기 하듯 기본 찬 나물 비빔밥 샌드위치 다음 함 하 차라리 보쌈 민속 주점 횟집 마무리 하 는걸 추천  맛없는게 없음     
89,소문난순대국,서울 도봉구 도봉산3길 56 1층,4.6,국물 고기 수육 다 냄새 안나 맛있어요  깔끔하고 맛있어요 마늘 후추 들깨 향 적절하게 조화 김치 전라도 스타일 시원하고 깔끔한 맛 너무 너무 좋았어요 사장 님 추천 레시피 감칠맛 맛있었습니다  평생 순 대국 중 최고 계속 같네요 
90,뚱보냉면,서울 도봉구 도봉로110길 51,3.2,맛 짱  만족 물냉면 한 표  냉면 때 맛있습니다 
91,리틀방콕,서울 도봉구 도봉로114길 22 1층,4.0,가성 비 좋다  지난번 맛있게 기 억 이나 또 음식 여전히 맛있었지만 계산 분 화가 많이 나  가기 불편한데 또 정도 맛있습니다 완전 태국 현지 식이 아니라 적당히 한국 식 그런 듯 가게 조금 많이 작은게 아쉽습니다 
92,맛보고갈비둥지 도봉직영점,서울 도봉구 도봉로150다길 16 가, 나동 1층,           
93,무한리필 고기싸롱 쌍문점,서울 도봉구 도봉로 454 1층,3.6,  고기 질도 좋고 밑반찬 신선하고 깔끔하다 그러나 음료 무제한 아니다 캔     원 이니 부담 음료 때문 감점  고기 퀄 서비스 그냥 그렇다 냉면 물냉 비냉 둘 다 괜찮고요 여기 메리트 샐러드 바 떡볶이 튀김 같은 사이드 메뉴 있단 점 고기 구울 때 그런 거 다 고기 다시 고기 반복 쭈아    가게 좁은 건 아닌데 웨이팅 있네여 그거 정돈 아니고요  배 많이 안경 아주머니 저희 불판 잘못 큰소리 화 내심 누가 손님 누가 직원 어이 없어서 리뷰  시 에갔는데 샐러드 바 신 경 도안 떡볶이 싱겁고 본사 민원 임 완전 불친절 영업 마감 시간 아닌데도 마감 정리 정신 업슴 
94,골목순대국,서울 도봉구 도봉로133길 41,4.4,순 대국 한 그릇 이제      원 이 부담스럽군요 작년 배추 가격 폭등 시 미제 공한 김치 지금 제공  진짜 맛있어요    안나 깔끔한데 깊어요  진심 국밥 좋아하는디 너무 예민해서     여기 광명    
95,창동두리네곱창전문점,서울 도봉구 해등로16길 46 1층,2.8,정말 맛있고 양도 많네요  예전 맛 아님 양도 내 사람 들    네로 곱창 집  곱창 볶음 달라 왜 당면 볶음 곱창 곱창 안 
96,갈비일번지 방학점,서울 도봉구 도봉로 663-12,4.3,맛 있는데 일 분 들 오지랖 넓음 때 없는말 시킴  짐 맛있어요  맛있어요 후식 냉면 완벽 가끔 밑반찬 상태 들 조금 아쉽 해    그래도 만족스러운 집 
97,갑식이네착한낙지,서울 도봉구 도봉로150길 43 ESA단지상가 136~138호,1.4,브레이크 타임 때문 채 여기  시 에   분 기다려 음식 니 브레이크 타임   분 빨리 참나 이런 개 같은 경우 밥맛 뚝 끝 불친절 안 기분 드럽네  안경 머리 짧은 여자 종업원 최악 기본 개념 상실 불친절 싸가지 없음 사장 님 왜 그런데 인건비 낭비 돈 기분 잡 여기 가세  양주 착한 낙지 
98,이코이,서울 도봉구 도봉로112길 20 1층,4.4,토요일   시 방문 영업 안    맛 그럭저럭 괜찮은데 가격 저렴한만큼 양도 너무 깜짝 거기 가격 더 뭐  가격 아쉽지만 진짜 너무 너무 맛있는 곳 이   또 무척 친절하셔요   
99,한스친친 창동점,서울 도봉구 노해로 341 신원리베르텔 2층 202~204호,2.1,배고프다 점심 특선 누룽지 탕   분 째 뭐 안 점심시간 다지 맛 나발 음식   시   분 에 주문   분 째   가지 안  별 하나 아까 움 집앞 바로 세 일 다 고              항상 진짜 불친절하고 그래도 가족 모두 맛 진짜 개판 임 일단 이렇게 맛없는 곳 처음 난감했음  짜장 곳 중 가장 짜장면 간 안 처음 봄 일반 간의     배 정도 먹기 힘듦 짬뽕 가성 비 좋음 다양한 재료 볶음밥 가성 비 매우 안좋음 볶음밥 맛 없을 뿐더러 짜장 퀄리티  분 짜장 못 후식 튀김 같은게 있는데 딱딱하고 맛 없음 결론 안 집 
100,산과산사이커피로드,서울 도봉구 도봉로180가길 96 4층,4.8,    분위기 조아요     
101,화로몽 창동역점,서울 도봉구 노해로 379,4.1,    딸아이 남친 숯불 닭갈비 자랑 닭갈비 닭갈비 밥 김치찌개 추가   인분 포장 반찬 골고루 미니 용기 정성 밑반찬 소 소 김치찌개 중간 맛 돼지고기 생 고기 김치 베스트 듯 닭갈비 밥 맛 요 소스   종 갈릭 식초 매콤 소스 초장 쌈장 골고루 봄 갈릭 콩가루 맛 요 초장 굳이 메뉴 닭발 담 요것 볼 요량 여 전체 적 괜춘함    화로 몽 숯불 닭갈비 진짜 맛집 
102,카페152길,서울 도봉구 도봉로152길 29-3 1층,3.9,    타르트 그냥 맨손 빵 들 맛있는 데 제 타르트 크림 너무 너무 느끼했어요  퀸 망은 맛있었음 빠짝빠짝 달달 합리 적 가격 타르트 비 추천 크림 젤라틴 비중 너무 높고 별 맛 없음 로 상 맛있다길래 그거 재 방문 생각 있음 
103,맥도날드 쌍문DT점,서울 도봉구 도봉로 541,3.4,제 주 문 한 메뉴 단 한 개도 안 다른 메뉴 들 다 거의 짬 처리 용 같아요 시간 주문 그런거 같네요 죄송합니다 매장 방문 사과 안 다 매장 밖 사과 디테일 정말 더 이상 귀찮게 주문 안 번창  어이 백발 노인 네 사장 사장 비슷한거야 바빠 토욜 런치타임   시   분 왜 직원 고름 이 냥반 주문 멀뚱멀뚱  분 을 서잇엇 바빠서 못햇 어 직원 고름 그만 키 오스 설치 정신차려 꼰대  맥 모닝 감 주차장 맛있음     매장 바닥 순찰 바 선생 갓 퀴 벌레 발견 신경 좀 
104,골목집숯불갈비,서울 도봉구 노해로63길 51,4.5,돼지고기 품질 너무 좋고 소고기 인생 맛집    밑반찬 특색 있어요    년 전이 지금 맛집 내 사정 허락 매 주마 돈쭐  반찬 별거 없고 고기 다 고기 뭐 맛있다고 별 점 높은 돈 그냥 땅 
105,버거킹 쌍문SK점,서울 도봉구 도봉로 437 SK주유소,2.9, 일 경 오후  시 쯤 알바 쓰레기 들 코로나 애 들 버거 판 후 가족 들 감기 얼마나 지저분하게만 매 장안 손님 꼴랑   명 우리 때 인사 응대 뭔가 찝찝한 쌔 한 느낌 코로나 알바 태도 다른 매장 조리 실 다 죄다 버거 깨끗히만 같지도 알바 쓰레기 들 니 들 못 행동 들 코로나 심하다 진짜 바깥 음식 안  배달 기네스 머쉬룸 와퍼 시 켯 버섯 말씀 드렷 더니 친절한 알바 죄송하다고 연 신 사과 미안할 정도 내 그래서 그냥 다시 배달 마음 아프더라 알바 님 잘 좋겠어요  주문 좀 제대로 주심 안되나요 와퍼 치즈 와퍼    불고기 버거 피클 마 빼 달라 요청 다 있질 안 왜 포장 체크 기껏 이 뭔가    
106,리얼파스타,서울 도봉구 도봉로112길 26,3.9,엄청 깔끔하고 맛있어요 특히 피클 짱  차돌 매콤 크림 파스타 가요 자극 적 맛있어요 피자 평범해요     
107,공릉동닭한마리 방학점,서울 도봉구 도봉로 683,3.9,직원 싸가지  매장 넓어요 다만 청결 별하나 입니다 남여 공용 화장실 비누 없어요 비누 없다 물 비누 없다 여러 사람 곳 비누 안 이 뭔 헛소린 여러 사람 비누 그걸 제 정신 일 아줌마 들 그 화장실 비누 없으니    비누 생기 남 들 소변 보고 떵싸던 손 언제 비누 손님 음식 줄껀가 비 위생 음식점 개선 의지 없어 의지 있으면 비누 음식 맛 중요하지만 사장 청결 직원 위생 생각 중요하다 생각 맛나 식당 많은데 지저분한 곳 굳이 추천 안해  아주 맛있고 친절합니다 
108,삼오낙지,서울 도봉구 도봉로110길 95 1층,4.8,사장 님 친절하고 맛 좋아요  맛 나용  노 맛집 
109,스타벅스 방학역점,서울 도봉구 도봉로 684 1층,3.1,느림  어중 중이 물 것 아니고 에스프레소 물 아메리카노 양심 불량 있는 것 아닐텐데 식수 대 몇 달이 안 건 무슨 도둑 놈 심뽀일까  가끔 곳 벽 컬러풀 그림 이뻐요 집 근처 있는 곳 스타벅스 있어서 편리 영화 볼때 근처 식당 이용 잠깐 씩 얘기 아아 마시기 좋은 장소 입니다 
110,혜화면옥,서울 도봉구 도봉로 503 1층 101,102호,           
111,잔디불,서울 도봉구 도봉로156길 8,4.9,가성 비 맛 굿         
112,참치스시화,서울 도봉구 도봉로 506 1층,3.8,사장 님 친절하시고 회 너무 맛있어용 메로 구이 짱 맛  제 참치 진짜 좋아하는데 요즘 외식 못 오랜 만 회 진짜 많이 것 같아요    진짜 제 페이 버릿 음식점 입니당  엄청 맛있음   둘이서 얼    친절하신 사장 님 싱싱하게 회    반찬 들 다 맛    
113,버거브라더 쌍문점,서울 도봉구 도봉로133길 53,4.8,        진짜 맛있어요 눈 곳 없어서 이번 정말 맛있네요    사장 님 오래오래 운영 부탁드려요 
114,버거킹 쌍문점,서울 도봉구 도당로 6,3.0,와퍼 와퍼 고유 소고기 패티 맛 때 대 만족 버거킹 버거 종류 다양하지만 오 리지 널 와퍼 젤 맛있다 와퍼 맥날 롯데리아 왜 와퍼 와퍼 알 다감 품질 이 젠 맥날 맛있다 동네 버거킹 있어줘서 땡  아무 생각 없이 테이크아웃 쇼핑 백 보고 기분  불친절 버거 사진 달라 황당했어요 분명 와퍼 토마토 아예 없고 고기 너무 얇네요 버거킹 원래 이런 건 여기 이런 건 소비자 기만 행위 같네요 
115,창골생삼겹살 본점,서울 도봉구 도봉로 588 1층 1호,4.7,삼겹살   인분 주문 김치 맛있 궁 버섯 양파 최고 삼겹살 냄새 안나 정갈하게 누룽지 맛있어요 같이 짱짱  동네 핵 맛집  동 네 근처 도 처음 친절하고 파 상추 맛있게 삼겹 목살 두 가지 종종 
116,장위동유성집 도봉점,서울 도봉구 도봉로180나길 56,4.0,    대 존맛 고기 비싼 편이 술안주 한 점 씩 먹기 좋아요 비싸도 또 의향 있어요 왜냐면 대 존맛  맛집 
117,북청식당,서울 도봉구 노해로69길 15-15 1층,5.0,여기 미역국 진짜 밥 도둑 같다      우이동 북청 목살 창동 북청 삼겹살 근래 삼겹살 중 가장 맛있었고 미역국 볶음밥 아주 훌륭함 
118,행복한양,서울 도봉구 도봉로110나길 27 2층,4.1,가성 비 최고 맛집 입니다 사장 님 친절하시고 조개찜 양도 짐 좋네요 기본 찬 셋팅 김치전 쫄면 홍합 탕 메인 조개찜 대박  가성 비 치면 최상급 입니다  맛 중국집 중상 그러나 사장 님 두 분 인정미 좀무 하리 싫으면 말 
119,갯마을,서울 도봉구 해등로3길 27,4.3,무한 도 다른 곳 돈 퀄리티 매우 만족스러워 일부러 한 시간 친절 친절 충 창렬 친절한데 가세  맛 좋고 친절하여 가족 들 자주 식당 요즘 코로나 때문 집 배달 주문 하 맛있게 맛집 친절합니다  맛 좋고 가격 적정하고 분위기 좋고 사장 님 매우 친절하고 주변 분위기 좋고 야생화 공원 식후 산책 가족 끼리 친구 끼리 동료 끼리 밥 잔 악 좋은 곳 입니다 
120,맥도날드 방학역DT점,서울 도봉구 도봉로 735,1.3,비싸고 맛 그냥 그냥 제발 평가 좀 제대로  왜 맛 대가리 없냐 같은 빅맥 이렇게 맛없게 있나 희안하 네 업주 골프 댕기 관리 좀해 별 점 꼬 안보  바쁘고 힘들어서 그렇다고 방문 때 마다 불친절 그냥 기본 대단한 서비스 친절 것 아닌데 집앞 매장 정말 몇 년 간 직원 대다수 정말 한결 같이 불친절 사람 다 비슷하니 저만 아닌거 같고 직원 들 본인 퇴근 손님 본인 들 응대 직원 들 생각 여기 훨씬 더 바쁜 번화가 매장 이렇게 기분 나쁨을 적 이 없음 이 매장 한결 같이 이런 걸 누구 한 명 딱 사람 없이 다 비슷 비슷한 마인드 같네요 
121,고기굽는베베,서울 도봉구 도봉로 723 1층,4.8,   싸가지 개 없음 진짜 일 싫음 키 오스 설치 같은 서비스 직 일 바쁘고 진상 많고 정신 없다고 감정 일 다 그렇게 일 자주 가도 때 주문 때 카운터 알바 눈치 보기 바쁘 고전 직원 싸가지 곳 여기 하나 임 케챱 한 개 있길래 좀 더 개 툭 곳      점도 아깝 사장 여기 리뷰 안보 계속 근무  맛집 입니다  사장 님 주방 장 닌 모두 모두 친절하고 항상 맛있고 때 기분 좋은 곳 
122,스시영,서울 도봉구 노해로69길 26 시티월드 2층 207,208호,방학동 터 줏대 감사 장님 직원 분 바쁜데도 왕 친절하고 롱런 하 이유 있는 맛집 어중간한 방학동 체인점 고깃집 가지 여기 개 강추 유명하고 줄 이유    음         
123,카페더로비,서울 도봉구 방학로 171-5,4.2,        최애 카페    아인 슈페 너 필수 
124,세라젬웰카페 서울쌍문직영점,서울 도봉구 도봉로 571 1층,5.0,    시간 피로 싹 너무 개운한 느낌 입니다 직원 들 친절하시구요  세라 젬 카페 자주 마사지 커피 음료 맛있고 직원 분들 정말 친절하세요 
125,왕골감자탕 본점,서울 도봉구 노해로69길 15,2.1,음료 세라 젬 체험 가능해서 좋아요 직원 분들 다 친절하세요  불친철함 맛 그냥 그래요 혼자 뼈통 안 개불 친  그냥 그래요 칠갑산 가세 
126,스타벅스 쌍문역점,서울 도봉구 도봉로 480,3.6,    친절하고 좋아요     
127,도마다리 뼈다귀전문점,서울 도봉구 해등로 161,3.0,매일 출근 주문 곳 다 너무 친절해서 아침 기분 좋게 출근 너무 좋아요  뼈 해장국 선지 해장국 신선하고 맛있어요  손님 험담 손님 간 다음 
128,스마일닭강정,서울 도봉구 도봉로110아길 7,3.2,직원 예절 교육 똑바로      맛 없고 이 물질 그 이후 닭강정 있어요 골목 식당 엄청 기대하면서 진짜 맛 없었고 회충 지렁이 뭔 지 같이 그 이후 닭강정 못    
129,도봉산커피,서울 도봉구 도봉산4가길 4,4.7,친절하십니다 그런데 가격 많이 컵     원 이고 중     원 으로 가격 수정 맛 그냥 평범합니다  커피 향 좋은 카페 진짜 오랜 만 테이크아웃 우 로 바로 다시 또 사 마심    기 대안 인생 연유 라떼 영접 그렇게 싫은데 딱 고소하니 좋은 정도 커피 향 좋고 가게 인테리어 복층 형식 예뻤음 
130,마차이나,서울 도봉구 노해로63길 79 우림빌딩 2층 205호,3.4,분위기 좋고 커피집 이름 너무 맘 커피콩 신선하고 엄청 나 알 성비 무쟈 좋은 집 널리 알리  요기 익스 프레 스   분 이면 가계 생각 수수료 직접 전화 주문   분 이 무슨 이런 경우 주 문후   분 전화했더니 지금 배달 출발 그 후   분 이 더 진짜 말 진짜 최악 요  사장 님 맛 서비스 별로 
131,풍천장어직판장,서울 도봉구 도봉로 464,2.4,오늘 점심 망했다 이집 때문 짜장 짬뽕 주문   분 기다림 안나 말 지금 나가요   분 후 또 그때 짬뽕   개 자장 어디 그런데 맛 별로 맛없는 대왕 오징어 국물 맛 별로 창동 날 망했다 음식 만   분 입맛 별하나 아깝다  나이 제일 많아 아줌마 원 왜 오늘 안 셀프 다른 아저씨 들 테이블   분 자리 아줌마     제일 젊은 분 열심히 진짜 무슨 포스 사장 듯 어슬렁어슬렁 아저씨 들 테이블 고기만 확인 다른 직원 그냥 일개 직원 며     여자 그러니까 차별    비싼 돈 장어 이런 서비스 못 손님 어설프게 맛 얼마나 다른데      제 귀 사과 전 열심히 얘기 동네     절대 신안 장어 굽기 힘들어 안 셀프 라며 던 아줌마 아저씨 들 테이블 처음 끝 시드라 구 요 착 젊은 아줌마 
132,창동빈대떡,서울 도봉구 도봉로110나길 37,2.6,마늘 없어여      오래간만 여전히 그 자리 있어서 반갑 일요일  시 쯤 만 석 임 막걸리 한잔 
133,더맛있는족발보쌈 방학점,서울 도봉구 도당로 120 1층,5.0,오랫 만 포장 주인 듯  냉채 족발 맛있음 아쉬운 거 상추 조금 더     항상 족발 집 쫄깃쫄깃 부드럽고 맛있어요 사장 님 친절하셔서 맛집 이 용 
134,참숯구이장어가,서울 도봉구 도봉로 911,3.5,    가격 대비 맛 친절 개판 예전 대비 배  십년 전 가격 장어 질 너무 좋아 이 가격 의심스러웠습니다 먼데서 오늘 역시 맛있더군요 직원 분 친절하고 쾌적하고 반찬 맛 또한 최고 입니다 강남 이런 장어 집 생 겻으 좋겠습니다 밑 별하나 아깝다는 평점 경쟁 옆 가게 분들 꼭 
