,name,addr,grade,review
135,푸디스힐 (휴업중),서울 도봉구 방학로3길 6 SYO빌딩 지하 1층,3.9,도봉 쪽 이정 뷔페 별로 없지 초밥 무한리필 무한리필 고기 뷔페 대신 돈 좀더 여기  스파게티 피자 맛있어서 그나마 별   개 새우 개인 적 좋아해서 많이 편 작년   번 그 중 한 번은 딱 새우 다 상태 실망했던 기억 있었어요 하지만 설마 또 덜 저번 주 정말 실망 실망했네요 새우 덜 몸통 중간 투명한 생살 구 운 사정 마찬가지 이런 걸 다른 음식 들 건가 없는 음식 없어 불안하더라고요 직원 분들 친절하고 좋은데 음식 신경 좀  회도 맛 스시 평타 이상 음식 대 체적 조금 그렇게 많이 음식 이 정도 맛있고 음식 신경 티 많이 
136,귀한족발 수유직영점,서울 도봉구 도봉로110길 5,3.7,사장 님 가끔 이 젠   불친절해요  다 맛있는데 불족 최고  맛 자주 
137,599버거,서울 도봉구 도봉로 599 지하1층,4.5,    치즈버거 불고기 버거 존맛 이  위치 아쉽지만 햄버거 새우 볼 존맛 
138,제철쌈밥,서울 도봉구 해등로 139 미소애아파트 상가동 1층 107,108호,           
139,사랑채,서울 도봉구 도당로11길 5 1층,2.0,맛있다 가성 비 때 보통 카카오 맵 평점 낮은데 신경 쌈 오 마카 세라 생각      왜 는걸 
140,이용선칡냉면,서울 도봉구 노해로60길 66,4.7,여기 배달 자주 진짜 맛있음 홀  양 많고 맛있고 너무 친절하십니다 후식 야쿠르트  너무 친절하신데 맛 있고 양도 많다 배 냉면 건 첨 임 아주 굿 
141,어랑생선구이,서울 도봉구 도봉로168길 13,3.3,맛있습니다 친절하고요  뚝배기 김치 제육 간이 약하고 돼지고기 맛 안남 임 연수구이 기본 적 아무 맛 안나 고기 미리 듯 오래된 맛 더 맛없음  찬 맛있고 생선 또한 맛있습니다 정말   밥 도둑 말 밥 공기 생선 양 많습니다 결국 공기 추가 수 없었습니다 오랜 만 정말 맛있는 생선 생선 좋아하시는 분 들 강추 입니다 
142,카페7179,서울 도봉구 도봉로110길 97 1층,4.0,평이 좋아서 좋네요  디저트 꼭 분위기 좋고 맛 있어요  글쎄요 두 번 좀 
143,돈까스대왕전,서울 도봉구 도봉로 486,2.9,대 체적 맛있는데 가격 쫌 비싼 것 흠  소스 너무 맛있어요 돈까스 소스 양배추 소스 짱 맛  전 옥수수 깍두기 밑반찬 있었는데 일부 메뉴 천원 씩 말 이 돈가스 맛 그 전 일관 되게 맛있지만 조금 아쉽습니다 
144,옥동송어,서울 도봉구 도봉로191가길 6 1층,4.7,송어 맛있는데 야채 소스 정말 맛있습니다 그냥 깍 뚝 야채 얇게 있다고 설명 법 남녀 사장 님 전부 친절하셨고 회포 장이 얼음 봉지 사이 키친 타 올 보고 좋았습니다 매장 예쁘게 나중 부모님 모시 맛있게  깔끔한 식당 내부 가성 비 좋은 식단     
