,name,addr,grade,review
133,야래향,서울 중구 퇴계로10길 14,3.1,탕수육 특히 맛있는듯 쟁반짜장 꽤 매우 매운거 못 사람 주의  여기 중국 냉면 몇 그릇 최근 너무 맛 달라 주방 장 바 육수 준비 안되서 없이 이 가요 육수 준비 안 주문 안 아니에요     
134,창고43 무교점,서울 중구 무교로 21 더익스체인지 서울빌딩 2층,2.3,소고기 맛 있는지 손님 기본 곳 주문 하 주문  커피솝 커피 맛 별로  맛있음 역시 창고 
135,러시아 케이크,서울 중구 을지로42길 7,4.5,때 러시아 그 맛 그대로 입니다 러시아 케익 그대로 맛 진합니다 그래서 홍차 필수  꿀 케이크 진짜 맛있고 친절하 심 일 있을 때 다시 골목 주차 불가함 커피 그냥 연한 맛         오직 러시아 케이크 방문 위해     다시 옴 우유 케이크 뭔가 우유 푸딩 브라우니 위 맛 그냥 꿀 케이크        땅 근처 일 있으면 또 맛 근데 꿀 케이크 어디서 맛 뭘 그리고 종업원 러시아 여성 분 짱 예쁘고 한국어 필요한 만큼 잘 인상 깊었음 내 영어 저 것 더 이상할거 같은데 외모 커버 치기 글었으 영어 발음 연습 이상한 교훈 감 
136,토리아에즈 본점,서울 중구 동호로10길 13,3.3,시끄러운 것 또                       내 좋아했던 토리아 즈 이제 갑 변했군요 뭐 나 없어도 잘 너무나도 아쉬워서   
137,성진,서울 중구 수표로2길 5 청운빌딩 1층,3.6,최고 간장게장 반드시 밥  전화 응대 불친절해요  주변 손님 모 시기 좋은 곳 조용하고 깔끔합니다 
138,뚱뚱이할머니집,서울 중구 장충단로 174-1,3.4,맛 다 똑같이 남자 주인 불친절하고 남자 주인 담배 장사 담배 말 너무 싫었습니다 아직도 이런 데 있다는게 뿐  맛있습니다  족발 괜찮았는데 사장 님 남자 분 너무 불친절하셔서   처음 국수 같이 야하는 그런 문화 잘 족발 우선 그렇게 아니라고 무안 주시 듯 말투 잘 돈 눈치 밥   
139,참숯골,서울 중구 무교로 16 체육회관 빌딩2층,3.0,고기 안 집게 가세         
140,명화당 명동1호점,서울 중구 명동4길 32 2층,3.5,진짜 최악 주문 누락 이해 남자 사장 놈 바쁜데 주문 하 주문 안 다 얘기 밥 다 사장 님 그래도 그렇게 말씀 아니죠 분명 저희 쪽 주문 아    그럼 그랬나 죄송해요     건성 별 걸 다      식 대답     어이 없어서 영수증 리뷰 이랬더니     리뷰      아닌가요 장사 기본 마인드 뭐 그렇게 잘나셨길래 너 따위 하나 안 식 그따위 행동 말 내 돈 밥 기분 더럽네요 절대 가지     코로나 사람 또 라이  바쁘면 직원 더     
141,서울부띠끄,서울 중구 만리재로 209-1,3.1,소 곱창 토마토 리조또 최고 맛있어요    여기 음식 만리 방문자 로써 너무 좋다 다만   층 주문 방법 좀 그래서 별 하나 인터폰 주문 하 게 처음 너무 빵터지고 은근 불편함 직원 주문 인터폰 하라 함      번 방문   층 적응 안됨 대 체적 바질 많이 느낌 내 바질 좋아해서 그 런가 음식 정말 괜찮음     
142,현대칼국수,서울 중구 세종대로 76,3.9,친구 먼저 도착 일행 여자 남자 남자 하니 여자 한 명 남자 한 명 주방 말씀 여자 제 꺼 양 주심       단골 친구 제 꺼 양 보더 인정 함 기분 나빠서 면 사리 리필 번해서 다 먹음 옛날 칼국수 멸치 육수 맛 잘 양 많으 심 리필 팍팍해 리 필사 지면 안  특별한 맛 아닌데 자꾸 내부 좀 오래  노포 감성 칼국수 맛집 술 안 해장 느낌 
143,브레라,서울 중구 다산로 41,3.2,파스타 디저트 류 피자 도 미노 나폴리 띤 개인 적 더  맛있는데 한국인 입맛 좀 짤 수도  때 괜찮았어서 오랜 만             메뉴 페투치네 면 알덴떼          그 이상 안 기도 무쇠 팬 음식 다 다시 달라 파스타 떡짐 프로슈토 크루 치킨 커틀렛 같은 건 맛있었습니다 한국인 직원 분 매우 친절하십니다 재 방문 글쎄요 
