no,name,address,review_star,review_text,gu
2579,가야가야 이대점,서울 서대문구 이화여대5길 7-3,2.6,    나쁘진 그냥 돈 살빼는게 이득 일 듯 불쾌할 정도 맛 없는건 아님 재 방문 의사    자리 있는걸 보고 어떠한 설명 없이   만석   호통 무서워서 못 같아요     ,서대문구
2580,이화원,서울 서대문구 연희맛로 13,2.9,너무 친절하시고 맛 요 삼선 짜장 곳 중 제일 맛 요      또 용  아버지 함께 저녁 식사 정말 아버지 안 계셨으면 저 카운터 여자 분       소리   당신 같은 인간 들 때문 중국인 들 이용 안  예전 모임 장소 좋았어서 두 번째 방문 장소 공간 좋음 남자 사장 님 이 정도 친절하신 편 근데 리뷰 짬뽕 너무 먹기 힘들었음 굴짬뽕 굴 글 서빙 사람 정말 리뷰 음식 중국말 욕함        어이없었는데 모임 분위기 암 말 안함 ,서대문구
2581,편의방,서울 서대문구 연희로 36,3.8,만두 진짜 끝내줍니다 피 쫀득 육즙 가득   나머지 짬뽕 짜장 기본 이상   다만 좀 청결하지 못 한 점        군 만두 재미 ,서대문구
2582,또보겠지떡볶이집 신촌히어로점,서울 서대문구 연세로4길 19 2층,4.2,음 양도 맛 별로 왜케 맛없어진것 같지   떡볶이 감      원 이면 걍 치킨 이 젠 안      재료 맛 뚜렷하게 나 떡볶이 괜찮음  즉석 떡볶이 최강 자 ,서대문구
2583,미분당 신촌2호점,서울 서대문구 연세로5길 26-7,3.9,    쌀국수 넘버원 맛집  정말 조용했어요 슴슴 맛 아쉬웠어요 ,서대문구
2584,미스터서왕만두,서울 서대문구 신촌역로 16,4.5,    기대 이하 소가 너무 고기 기함 그래두 이 근처 소룡포 군 만두 살짝 아 수운 맘 재 방문 의사    만두 중 제일 맛있었음     ,서대문구
2585,가타쯔무리,서울 서대문구 명지대길 72,4.1,최고 우동  별 기교 안 우동 면 맛있으면  한때 집 다다다 자전거 타고 집 지금 이사 많이 못 간 오래 ,서대문구
2586,미도인 신촌,서울 서대문구 명물길 33 2층,3.6,등심 스테이크            원 같음 근데 그 준 맛 아닌듯 소스 애매하고 고기 오버 쿡         ,서대문구
2587,월순철판동태찜,서울 서대문구 연희맛로 17-14 1층,4.3,최고 맛집  맛있음 특히 볶음밥 근데 맵 못  맛 별   개 친절 별   개 ,서대문구
2588,녹원쌈밥,서울 서대문구 연희로25길 22,3.4,채소 이 신선할 수 있다니 이번 달 최고 음식 이름 값  쌈 채소 싱싱하고 여기 분위기 건강한 느낌 산속 찜질방 바이브 그리고 어머 릠 들 일 그런지 더욱 정감 가요 친절하고 좋으 심  보쌈 오징어 볶음 ,서대문구
2589,옐로우보울,서울 서대문구 충정로 7 지상에서 보이는 지하1층(세븐일레븐 바로 옆),4.2,가성 비 별로         ,서대문구
2590,독수리다방,서울 서대문구 연세로 36 독수리빌딩 8층,4.1,분위기 최고  뷰 좋고 영업 좋고 공부 괜찮음 다만 퀄 가격 좀 셈  뱅쇼 레몬 생강차 음료 맛 평범한데 토요일   시 였음에도 자리 없어   분 정도 대기 차 값 비싼 편이 특별히 맛 있지도 늘 사람 들 많은 것 신기합니다 ,서대문구
2591,매뉴팩트커피 연희본점,서울 서대문구 연희로11길 29 2층,4.3,플랫 화이트 짱  공 강 때 서문 쪽 식후땡 국룰  사람 없으면 친절하고 사람 많으면 불친절해지는 곳 ,서대문구
2592,완차이,서울 서대문구 명물길 50-7,4.1,매운 홍합 최고  그냥 저     ,서대문구
2593,참맛집,서울 서대문구 경기대로 82 지하1층,2.3,    하나 아깝습니다 비싸면 음식 제대로  별로 알 ,서대문구
2594,스웨이커피스테이션,서울 서대문구 연희로11길 61,4.1,분위기 정말 끝내주는 연희동 카페 요 안 어디 유럽 역사 온 것 같습니다 호주 식 커피 디저트 수 있는 곳 단호박 치즈케이크 단호박 본연 맛 진하게 좋았고 호주 식 커피 고소하고 맛있습니다  더치커피 바나나 케이크 분위기 진짜 좋고 밖 것 넓음  무난 무난 괜찮아요 ,서대문구
2595,그릭데이 이대점,서울 서대문구 신촌역로 22-8 1층,3.8,    사람 주문 시스템 없나요 직원 넷 이 거 본사 연락 아쉬우면 전산 에러 있던지 줄 서서 서비스 정신 진짜 별로 네  무난 함 근데 여기 예전 요거트 겨털 걸 유명함 겨릭 데이 ,서대문구
2596,신촌수제비,서울 서대문구 신촌로 87-8 1층,3.3,그냥 맛 곳 금은 안감      아니 계산 아줌마 왜 그러세요 ,서대문구
2597,심야식당텐조,서울 서대문구 거북골로20길 71 1층,4.5,    스키야키 육회 쬰맛  맛있어요 분위기 좋아요 ,서대문구
2598,클로리스 신촌점,서울 서대문구 연세로4길 38,4.1,빈티 소품 아늑한 분위기 좋음 의자 푹신해서 더 좋음         ,서대문구
2599,부탄츄 신촌점,서울 서대문구 연세로5길 26-9,3.1,무난 라멘 집         ,서대문구
2600,신촌해물칼국수,서울 서대문구 신촌로 125 2층,4.2,맛있어용 낙지 메뉴 추천  가격 대비 가성 비 우수하고 맛 훌륭합니다 해물 칼국수  같은 자리 영업 계십니다 ,서대문구
2601,청송함흥냉면전문점 본관,서울 서대문구 연희맛로 6,3.5,밍숭맹숭 맛 중독 어른 들 가면 서비스 우리 들 끼리 가면 안주 느낌  로스쿨 시절 내 해장 전담  전체 적 가성 비 맛 없진     먹기 좀 비싼 감 있습니다  천원 이나 많아도  만원 이 적당한듯 ,서대문구
2602,현명식탁,서울 서대문구 명물길 32 5층,4.2,콜키 프리 이만 가성 비 레스토랑 없는 것 같습니다 직원 분들 너무 친절하시고 점심식사 즐겁게 다음 와인 일 있으면 또 그리고 현명 세트 기준   인 충분합니다  가성 비 맛집 직원 들 친절해요 무엇 맛있어요 특히 저 꽃게 로제 정말 맛있게     ,서대문구
2603,연희곰탕,서울 서대문구 증가로 17 1층,4.3,깔끔하고 간도 적절하니 맛있음 김치 맛 조금 아쉬웠지만 종종 방문 맛 종업원 친절하고 무엇 김치 소스   인분 씩 따로 좋습니다         ,서대문구
2604,효동각 본점,서울 서대문구 연대동문길 24,3,댓글알바 오지 듯     아님 미각  셀프서비스 가격   처넌  짜장면  천원 ,서대문구
2605,모래내설농탕 본점,서울 서대문구 모래내로 271,2.6,그냥 그렇습니다 주차 편합니다 손님 항상 꾸준히 있습니다  설렁탕 자주 좋아하는 사람 들 괜찮은 식당 임 설렁탕 육수 꽤 진하고 적어도 특 고 기량 많음 그리고 가격 딱 설렁탕 가격 대 이 정도 무난 맛있어서 앞 시간 날때 방문 생각 임 다만 아쉬운 점 이 날 이런지 김치 깍두기 조금 아쉬웠음 또 설렁탕 고기 특수 부위 도가니 없어서 설렁탕 특수 부위 맛 사람 들 아쉬울 듯 정리 집 가까이 있으면 번 정도 설렁탕 집 그 이상 그 이하 아님  해장국 맛 도대체 왜 이렇게 변했나요 이 해장국 마늘 국 조금 과장 없이 정말 마늘 맛 안 갑자기 왜 이렇게 마늘 마늘 무슨 억하심정 ,서대문구
2606,연어초밥,서울 서대문구 연세로2길 94 1층 3호,4.8,    가격 대비 연어 너무 맛있음 밥 살짝 아쉽 재 방문 의사    사장 님 정말 친절하시고 초밥 구성 좋고 상당히 맛있어요  연어 불 초밥 진짜 맛있어요      그런데 공간 매우 협소함 세 테이블 있음   ,서대문구
2607,달인꽈배기,서울 서대문구 통일로 205-3,3.8,    생생 정보 꽈배기 맛집  겉 쫄깃하 못 겨 맛 있고 여 특이한 꽈배기 일반 꽈배기 확실히 차별성 있음 ,서대문구
2608,여우골,서울 서대문구 연세로5다길 10,3.6,대중 적 곳 샤리 달 게 호불호 갈릴 만  기 본 초밥 여우 초밥 임 회 두 툼 데 살살 불편함 그런거 하나 없음 때 서비스 종류 매번 달라짐 생각 낮은 별 점 따름     ,서대문구
2609,연희김밥 본점,서울 서대문구 연희로11가길 2,3.4,어떨 땐 맛있고 얼 땐 이상하게 곳  전 매운 거 좋아해서 맛있게 한데 오징어 김밥 진짜 해 매운 거 못 분 들 도전     ,서대문구
2610,하이드미플리즈,서울 서대문구 통일로39나길 5 1층,4.3,알바생 들 매우 시끄러 움 대딩 과방 줄  지 글 글 브라우니 맛있어요  커피 위험해 요   커피 맛 크림 신경 빵류 좋아요 아인슈페너 홈 메이드 실패한 아쉬워요 ,서대문구
2611,롯지190,서울 서대문구 홍제천로 190 1층,4.7,조용한 카페 좌석 많지 혼자 방문 좋은 것 같아요 커피 고소해서 좋네요  내 홍제동 최애 카페 오래오래 롯        ,서대문구
2612,복성각 서대문점,서울 서대문구 통일로 135 충정빌딩 지하1층,3.3,최고  무난 중식 당 내부 생각 넓고 룸 있어 웨이팅 없었습니다 음식 점심시간 것 빠르게 테이블 안 약간 끈 부분 아쉬웠지만 음식 들 전반 적 나쁘지  그렇게 뛰어난 맛 힘듬 중국 식 냉면   짬뽕   샤 오마이   뽁음밥     ,서대문구
2613,타코몽,서울 서대문구 신촌로 49,4.5,메뉴 다 맛있고 생맥 맛있어요 웨이 팅 부담 없었다면 격일 것 같아요  오 꼬 노미 평범 이상 타코야끼 진짜 맛있었음 배 안    개 자리 좁고 불편해서 조금 아쉽   명 이상 가면 아예 못  정도 아니고 자리 있으면     차 용 좋은 곳 ,서대문구
2614,야바이,서울 서대문구 연세로7안길 37 지하1층,3,맛있긴 함 근데 슬슬 손님 많이 오기 시작 웨이 팅 시작 하 테이블 자꾸  시간 정도  오지 리뷰 주의 주문 때 우롱 하 게 있어서 그냥 우롱차 소주 그래서 소리 안 하이 볼 하나 사이다 하나 사이다 안 왠 우롱차 일행 술 아예 못 내 사이다 다시 전혀 술맛 아니지만 본적 없는 술 그냥     원 빵 셈 컵 주 댕 뭐 따갑길래 보    유리잔 입구 다     맙소사    심지어 그릇 그리고 결제 때 보 우롱 하이도 아니고     원 짜리 우롱 차임 술 아니고 그냥 우롱차    물    진짜 위생 최악 책상 바닥 계단 온갖 군데 다 끈 림 심지어 무슨 피 규어 장식 장도 기름 때        뿌얘 진짜 개 더럽구나 하        진짜        위생 좋지 환기 안됨 맛 있으나 저렴하지는 ,서대문구
2615,로덴드론,서울 서대문구 연희로25길 82,4,    매장 넓고 음료 맛남  맛있는 걸 아니라 맛있게 걸 집 ,서대문구
2616,기꾸스시,서울 서대문구 연세로5다길 35,3.7,모 초밥 너무 맛있어 욥      예전 구성 약간 지금 가성 비 좋음 ,서대문구
2617,서대문족발 본점,서울 서대문구 충정로6안길 54,3.4,        씨 네 마운틴 권일 용 교수 편 일단 찜 ,서대문구
2618,산천마루,서울 서대문구 세검정로1길 21,4.1,누룽지 백숙 무조건 여기     회식 장소 예약 가능해서 좋았어요 누룽지 닭백숙 닭 평범했지만 누룽지 정말 맛있더라구요 같이 김치 맛있었어요 부추 전 평범 누룽지 다시 것 같아요  배달 맛있어요 아기 들 좋아해요    ,서대문구
2619,설레임삼겹살1989,서울 서대문구 연세로5가길 31,4.2,친구 같이 가격 가성 비 맛 아주 완벽합니다  맛있어요 좋아요 가성 비 좋은 가게     ,서대문구
2620,아웃백스테이크하우스 신촌점,서울 서대문구 연세로12길 33,4,수회 방문 많은 지점 들 폐점 아웃백 지점 중 제일 괜찮아요 서버 분들 친절한 편이 고요 다만 평일 주말 것 없이 런치 대기 많아요      점 거품 많이 아웃백 좀 실망했음 음식  운 없어서 인지 안내 별로 여러 면 하지만 금테 남자 분 에이스 입니다 ,서대문구
2621,푸어링아웃,서울 서대문구 연희로11나길 7-7,4,    팬 케잌 맛있습니다 뱅쇼 커피 마실껄  깔끔하고 무난 ,서대문구
2636,현대수산,서울 서대문구 서소문로 45 SK리쳄블 1층,3.6,가격 어이없이 비싸고 개인 적 임  지도 정보 수정 부탁드립니다 가격표 지도 정보 달라  소주  천원 ,서대문구
2637,마녀주방 신촌점,서울 서대문구 명물길 21 지하1층,4.1,가성 비 좋다는 댓글 다 알바 임 맛 분위기 사진 때 딱 핸폰 해상도 안 정도 접함 근데 가격 두 배 급식 들 인스타 용 맛집     가격 저렴하지만 양도 많고 무엇 직원 분들 정말 친절하다 기분 좋게 좋습니다  친절하시고 가성 비 괜찮아요 ,서대문구
2638,헬로방방 남가좌충암점,서울 서대문구 명지대길 103 7층,4.7,가성 비 최고  장점 애 들 좋아한다 단점 애 들 많다  아이 들 좋아해요 좋아요 ,서대문구
2639,춘천집닭갈비막국수,서울 서대문구 연세로5가길 1,3.1,맛 그럭저럭 하지만 직원 분들 체계 안 느낌 다시 방문 같네요  평범  사리 치즈 추가 안 큰일 뻔 막국수 무난 다 괜찮았어요 다만 옷 냄새 엄청나요   ,서대문구
2640,포석정,서울 서대문구 연세로11길 25,4.1,무난          또                    오랜 만 그때 그대로 네 좋아요     불 백 제육 훨씬 맛있습니다 근데 늘 기름 너무 너무 너무 많아요 종업원 분들 친절하고 매장 분위기 좋습니다 대학가 술집 위생 좋은 편이 이 쪽 생각 날 것 같아요   년  월 두 번 방문 ,서대문구
2641,유야케도쿄,서울 서대문구 이화여대3길 28 1층 101호,4.1,    어 처음 때 두번째 때 더 맛있다 근데 아쉬운 점 있다면 안 치즈 금방 위 치즈 거 담 등심 안심 징  토요일   시 조금 방문 이 가격 이 퀄리티 최고 입니다     ,서대문구
2642,타코벨 신촌점,서울 서대문구 연세로 26-1,3.3,김치 퀘사디아 존맛   외국인 분들 많이 수정         몇개 월 다시 감자 튀김 김치 비율 아쉬워졌어용    나쁘진  별로 퀘 시디 퍽퍽 돈 아까 움     ,서대문구
2643,연탄생고기집,서울 서대문구 홍제천로 76,4.6,너무 맛있어요 고 기 퀄리티 반하고 김치 두 번 반하고 왜 이렇게 맛있나요 짱짱  자주 곳 입니다 너무 좋아요 항정살 최고   먹자마자  서울 일기   동 네 주민 종종 항상 사람 많다   서버 분들 친절하 심   삼겹살 목살 항정살 껍데기   기본 찌 김치 콩나물 깻잎 장아찌 쌈무   담 복분자 근데 껍데기 날 때 있음   불호 이 땐 아주 바싹 굽 인절미 가루 그득 그나마 만해 짐 갠 적 명 이 나물 있었으면 좋겠당   화장실 안 ,서대문구
2644,금옥당 연희점,서울 서대문구 연희로11라길 2 1층,3.3,포장 예뻐 선물 딱임      포장 값 듯 은은하다못해 무맛 ,서대문구
2645,맛있는칼국수 본점,서울 서대문구 불광천길 150,4.2,칼국수 보리밥 맛있어요 가격  만원 이라 조금 비싼 감 있네요 국물 맛 너구리 라면 진한 맛 이 좀 아마 육 수 낼때 바지락 다시마 많이 주차 가게 뒤 골목  만두 맛있어요  가격 너무 비싸요 차라리 가격 반 양도 조금 줄 팔면 더 자주 아쉬움 ,서대문구
2646,벽제갈비 신촌점,서울 서대문구 명물길 22 2층,3.4,양 곰탕 양도 많고 맛있어요 소고기 별루  고기 너무 비싸고 가격 대비 그냥 그런데 평 냉이 아주 맛     ,서대문구
2647,식탁 하늬솔점,서울 서대문구 성산로 527 하늬솔빌딩 1층,2.6,    옛날 괜찮았는데 리뉴얼 세트 메뉴 구성 별로 맛없음 예전 시 그 니 처 메뉴 들 그나마  전 보고 맛있길래 일부러 또 방문 갑자기 브레이크 타임     시대 그 어디 공지 하나 없이 짜증났네요 ,서대문구
2648,한림돈가,서울 서대문구 연세로7안길 16-4,3.5,    맛 신촌 탑 클래스 서비스 영 파 어르신 죄송하지만 그냥 할머니 서빙 젊은 친구 들 직원 좋을듯 해     ,서대문구
2649,호밀밭,서울 서대문구 신촌역로 43 1층,4.3,맛있어용  우유 빙수 맛집 우유 얼음 한 입 순간 듯   팥 떡 평범하지만 우유 얼음 독보 적 입니다 밀탑 처음 때 느낌 비슷합니다 딸기 빙수       원 입다     ,서대문구
2650,형제옥,서울 서대문구 충정로6안길 3 1층,4.6,형제 옥 사랑 입니다 감동 맛  나 착한 식당     ,서대문구
2651,연대포,서울 서대문구 연세로7길 26 1층,3.7,    전과 막걸리 굿     ,서대문구
2652,명인강메밀,서울 서대문구 충정로 43-4 1층,3.6,안산 트레킹 후 단체 모임 장소 굿    비빔 막국수 양념 뻔한 맛 아니어서 맛있었어요 면도 차갑게 완전 만족 막국수 하나       원 가격 너무 부담스러워서 별 하나 빼     ,서대문구
2653,미네르바,서울 서대문구 명물길 18 2층,4.6,신촌 찾기 힘든 고 즈 넉 함  커피 맛 요 복잡한 신촌 속 그나마 여유 수 있는 곳  커피 진짜 맛있어요 사과 차 도 맛있음 가게 조금 작 특유 포근한 느낌 있어 좋아해요 ,서대문구
2654,고냉지,서울 서대문구 연세로2마길 30,4.2,직원 분들 친절하시구 맛 좋고 양도 많고 대 혜자  보쌈 김치찌개 계란말이 모두 수준 급 맛 직원 분 친절했어요 자주 방문 것 같습니다  이 렇 게 맛 있 어 도 나 요     ,서대문구
2655,웅네서서갈비,서울 서대문구 신촌역로 13-1,3.1,평점 낮아서 고민 너무 괜찮았습니다 갈비 별로 안 좋아하는데 맛있게 사장 님 인상 너무 좋으시고 종업원 분 들 친절하셨구 분위기 차분해서 대화 괜찮았어요  갈비살 동치미 국수 맛있음  맛 별로 상추 너무 가게 분위기 어수선하다 양념 소갈비 밋밋했다 ,서대문구
2656,모래내곱창,서울 서대문구 증가로10길 26,4.4,    맛 무난 함 양 갓 성비         인분 포장 상추 따로 포장 주시 양도 짱 많아요   인분   인 충분히   가성 비 최고   ,서대문구
2657,청담동포장마차,서울 서대문구 연세로4길 25,4.2,두부 맛집 진짜 두부 메뉴 꼭  맛 있었는데 남 종업원 들 조신 못 양 애취 같아요 재 방문 의사     년  월 방문     ,서대문구
2658,비밀,서울 서대문구 이화여대7길 48 경국빌딩 1층 101호,4.3,맛있긴한데 기억 스타일 아님                                                                                                                                                               ,서대문구
2659,이품,서울 서대문구 연희로11길 20,3.6,동 나 짜장면 집 제일 괜찮음  그럭저럭   이품  연희동맛집  연희동중식당별 기대 안 깜짝 놀란 중식 당  이품 짬뽕 매콤 함 담백함 그리고 깔끔함을 동시 어려운데 이 곳 짬뽕 그것 마치 강릉 쪽 걸쭉한 짬뽕 짬뽕 아니라고 시위 이 곳 탕수육 전혀 바삭 함 없고 부 전형 적 옛날 탕수육 때 추억 음식 바삭 고기 식감 이 집 특유 과 달콤한 소스 인해 충분히 맛있다 누룽지 탕 또한 대박 짬뽕 비슷한 느낌 전분 그런지 담백하지만 깊이 있는 누룽지 탕 국물 많은 여운 누구 간 맘속 인생 중식 당 만 곳 강력 추천 주차 불가하고 가격 대 좀 있는 편임 ,서대문구
2660,평택고여사집냉면,서울 서대문구 연희로 81-9 1층,4,평양 냉면 너무 맛있어요 육수 살짝 간간 평양 냉면 아직 어려운 초보자 딱이에요 고추 같이 개운하고 제육 녹두 전이 미침           ,서대문구
2661,폴앤폴리나 연희동점,서울 서대문구 연희로11길 56 1층,4.4,버터 프레첼    가게 앞 이 사가 맨날 맨날  굿굿 ,서대문구
2662,오소오소 서대문직영점,서울 서대문구 충정로 47 신원빌딩 지하 1층,3.5,맛 드럽게 없고 불친절해요  가성 괜찮은데 뿔테 남 직원 사장 님 불친절  영업 시간 업로드 제대로 안 해 허탕 침 이런 건 고객 약속 아닌가 ,서대문구
2663,위샐러듀 이대점,서울 서대문구 이화여대길 52-31 1층,4.7,    풀 문 이나 루나 꼭 진짜 맛있음 브로콜리 올리브 안 좋아하는데 위샐러듀 다 최애 맛집 입니다    풀문 루나      인    이전 레드 풀 풀문 더 취향 이 젠 항상 풀문 곳 끼 식사 스프 류 좋아하면 레드 풀 밥 좋아하면 풀문 딱    풀문 두부 튀김 정말 맛있다 그리고 각종 콩 올리브 버섯 등 각종 채소 신선해서 좋음    풀문 위 흰 소스 밥알 부드럽게 게 좋음    다만 가격 슬슬 이 젠 좀 비싸져서 가끔 가게 ,서대문구
2664,올레무스,서울 서대문구 연희로5길 58 1층,4.2,절로 고개 맛 딸기 카다멈 타르트 몽블랑 둘 다 맛 굉장히 풍부함다음 방문 때 호 차 아이스크림 샬롯 타르트 츄 라이 것 샬롯 타르트 딱 예상 정도 맛 호 차 아이스크림 괜찮음  평범한 디저트 때 곳  차도 디저트 다 좋아요 구 움 과자 크게 안 좋아하는데 이 곳 구 움 과자 정말 맛있어요 케이크 아이스크림 류 맛있구요 연남 가면 꼭 곳 입니다 다만 자리 협소해 아쉬워요 ,서대문구
2665,원조부안집 서대문점,서울 서대문구 통일로9안길 22 1층,4.5,    서대문역 근처 이름 값 하 돼지 고깃집 인기 많아서 시끄럽지만 고기 두툼 쫄깃합니 오 돌뼈 같은 식감 좋아하면 오 득살 매력 적 수 있는 밑반찬 다양하고 셀프 추가 수 있는 것 장점     ,서대문구
2666,이정희떡볶이,서울 서대문구 증가로10길 14,3.7,명지대   떡볶이 중 하나 기본 적 밀떡 쌀떡 탄력 적 식감 우수 매콤 함 달달 함 균형 양념 쫄깃 떡 질리 튀김 류 크게 특별하진 전체 적 무난 맛 떡볶이 양념 범벅 강추      거의 김말이 떡볶이 특별하지 김말이 맛있어서 곁     근데 가장 아쉬운 거 순대 없음 ,서대문구
2667,에브리띵베이글,서울 서대문구 연희로11길 29,3.8,쫀쫀 베이글    뉴욕  맛있게 ,서대문구
2668,돈불1971 신촌직영점,서울 서대문구 연세로5다길 36,4.2,  연탄 초벌 오 겹살   인분 연탄 초벌 항정살   인분      인    반찬 수가 엄청 많음 백김치 갓김치 액젓 청어 알 와사비 등등 고기랑 밑반찬 짐    빈찬 리필    된장찌개 대신 따뜻한 김치 콩나물국 얼큰해서 고기랑 더    고기 초벌 구이 오 겹살 항정살 둘 다 정말 맛있음 쫄깃 통통함  신촌 고기 원 탑 비빔밥 필수  맛 하나 무조건 보장 ,서대문구
2669,마우디,서울 서대문구 연희로11길 18 1층,3.5,메뉴 맛 가게 하수 구 냄새 은은하게 테이블 불청 결함   전체 적 애매해서 분위기 있게 식사 곳 아님  크림 파스타 명란 까르보나라 둘 다 아주 맛있 크림 파스타 굉장히 예민한디 완전 합격 임 양도 많아서 다 못 파스타 때 또 예정 해물 토마토 맛있음  오픈 치킨 홀 손님 가득 찬 시간대 파워 믹서기 음식 맛있음    ,서대문구
2670,더풍년,서울 서대문구 독립문로 31-11,3.6,정말 처음 같지 서비스 그렇고 맛     화장실 좀 어케  옛날 같지    아쉽다 ,서대문구
2671,홍은손칼국수전문점,서울 서대문구 홍은중앙로 27,3.4,홀 위생 친절 도 다소 아쉽지만 맛 모든 걸 상쇄합니 날 가장 먼저 칼국수 집 입니다      역대 급 손 칼국수 생 계란 휘휘 저 어 천상 맛 김치 너무 적절 칼국수 중 제일 맛있음 오후 세시 이후 재료 소진 못 가능성 많음 ,서대문구
2672,방콕익스프레스 신촌본점,서울 서대문구 연세로2길 91,3.3,직원 대한 평이 많네요 네 별로 못 정말 최악 계산 때 쌍시옷 욕 음식 별로 못 정도 아니지만 이 돈 또 맛 아닌데 홀 있던 직원 때문 정말 정말 입니다      음식 맛 전체 적 밍밍 특색 없음 특히 커리 매우 후회 현지 맛 일지 ,서대문구
2673,원조봉순게장,서울 서대문구 경기대로 26-26 더스타일하우스디센트럴 201동 B106호,4.2,가성 비 최 고런 치 가격 맛 좋았다 살  신선하고 맛있다는 댓글 들 다 알바 한 입 아 삭 식감 맛 그냥 평범          해도 저 다시 안  깨끗히게 준비 부탁 결과 말 아니죠 과정 말 ,서대문구
2674,북성해장국,서울 서대문구 신촌로35길 7 1층,4.3,    맛있어요  예전 늘 깨끗하고 손님 많아도 차분한 분위기 사장 님 듯 한데 바닥 지저분하고 남자 사장 님 사용 행주 쉰내 심하고 여자 사장 님 너무 시끄러워요 맛 그대로 입니다 안타까워요 ,서대문구
2675,란주탕슉,서울 서대문구 이화여대2가길 18,3.2,맛있음 도삭 진수  바로 우랑 도삭 가끔  웨이 팅 맛 아님 ,서대문구
