no,name,address,review_star,review_text,gu
1763,소금집 델리 안국,서울 종로구 북촌로4길 19 신영빌딩 1층 103호,3.7,샌드위치 집 중 제일 비싸고 제일 맛있는 집햄 정말 맛있다 매일 통장 거덜날 듯 오늘 스프 추천 두 명 간다 하나 핫샌듸치 하나 콜드 샌듸 치 반 반 것  맛있네요 잠봉뵈르 추천  맛있어서 짜증나요 비싼데 또 짜증나요 ,종로구
1764,참치공방 종각본점,서울 종로구 종로9길 8 1층,3.3,확실히 다르긴 맛집 이 그 런가      손님 많고 그만큼 음식 맛 보장 내 일도 또  고급 진 분위기 참치 특히 신선해서 좋아요  오랜 만 친구 들 참치 야들야들 하니 좋네요 다음 번 남자친구 구 ,종로구
1765,영춘옥,서울 종로구 돈화문로5가길 13,3,맛 가격 청결 그냥 오래된 집  짱 맛있어요     종업원 무관심 인지 손님 기색 없지만 진한 곰탕 국물 맛 깊고 구수한 가게 입니다 가격       원 인데 아직 메뉴판 그대로 것 먹거리 식당 운영 깔끔함과는 동떨어졌다는 생각 입니다 ,종로구
1766,몽중헌 안국점,서울 종로구 북촌로 31-22,4,딤섬 짬뽕 페럼 타워 점 훨씬 짬뽕 해물 그닥 별로 없고 딤섬 너무 젓가락 밑 죄다 짜장면 안국 점 더 맛있지만 주차 너무 쉬운 공간 임 불구 발렛파킹     원 강제 적 결제 데스크 필수 서빙 분도 페럼 타워 점 남자 지배인 분 더 친절하셔서 앞 페럼 타워 점 듯         ,종로구
1767,혜화칼국수,서울 종로구 창경궁로35길 13,3.2,그냥 국수  칼국수 생선 튀김 소주   병 옆 중국집 금문 난자완스 대학로 코스  오랜 만 그 맛 절대 아님 원래 이렇게 맛 없지가 가게 할머니 자식 분 국물 함 다르고 그릇 지금 훨 양도 많았음 바싹 불고기 정말 맛있게 메뉴 지금 그냥 떡갈비 너무 많이 실망해서 속상합니다 예전 그 맛 ,종로구
1768,학림다방,서울 종로구 대학로 119 2층,4.2,고 즈 넉 분위기 너무 좋아요 비엔나 커피 짱 맛  가끔 씩 비엔나 커피 때 사람 없는 시간 가면 좋습니다  비엔나 커피 핫 대 존맛 파르페 ,종로구
1769,화목순대국 광화문1호점,서울 종로구 새문안로5길 11,3.9,미슐랭 그 잡채  그냥 말 필요없다 늘 너무 맛있어요  제발 주말 좀 안 ,종로구
1770,광화문한옥집,서울 종로구 새문안로5가길 7 세종클럽 지하 1층,3.1,별 점 왜 낮은지 이해 감 못 정도 아닌데 반찬 좀 더 달라 다 돈 더 내야 추가 비용 있다 소리 함 쌈 개 작은거 두 세 장 씩 더 달라 너무 많이 꼽줌      요즘 물가 생각 이해 정서 상 안  평생 이렇게 무성의 처음 입니다 보쌈 족발 시킴 세상 보쌈 고기 그냥 스폰지 정말 푸석하고 질 기고 한참 전 듯    가격 비싼 편이 무 말랭이 달라 쥐꼬리  천원   음식 너무 맛 없어요   이런 집 광화문 당당히 장사 한다는 게 어이 없네여 푸석한 고기 정말 충격 적임 보쌈 셋트 감자전 막걸리   만원    맛 더 주 고도 이건 아님 글구 알바 들 지인 들 글 무지하게 역겹네 진짜  별하나 아깝고 누가 대도 곳 비싸고 맛없고 불친절하고 외국인 한국 맛 이런건 줄 창피한 곳 메뉴 왜   인분 걸 안 ,종로구
1771,자하손만두,서울 종로구 백석동길 12,2.9,별 거 없는 빈대떡       원 만두국       원 이네요맛은 싱거워서 밍밍 한 데 가격 무서웠어요 게다가 날 추 원 데 대 기 인원 많고 위치 편한 곳 아니어서 차 가지 발렛비      원 이나 일이 없을 듯  맛 없으면서 가격 비싸면서 불친절 정말 비 추천 이런 글 처음  조금 더 넉넉한 마음 이면 좋을텐데 ,종로구
1772,체부동잔치집,서울 종로구 자하문로1길 16 1층,3.8,가성 비 대비 맛있어요 들깨 굴전 맛 리다 식 기류 물통이 깨끗하지 참고 분들 참고      들깨 칼국수 맛있어요 가성 비 좋은 집 ,종로구
1773,순대실록 대학로본점,서울 종로구 동숭길 127 우성빌딩 2층,4.5,직원 분들 친절하시구 음식 맛있습니다  순 대국 엄청 고급 지고 맛있음  맛 좋아요   ,종로구
1774,갓덴스시 종로점,서울 종로구 종로12길 14,3.6,맛있는데 가격 대가 있습니다 회전 초밥 들 가격 대가 있는 것 들 대부분 종류 한정 있어서 다른 초밥 야해요 다 때 새로운 종류 초밥 회전 대 건 적 없네요 그래서 별 하나 종업원 분들 다 친절하십니다      항상 웨이 팅 많은 곳 항상 사람 많아서 사람 없는   시 에 일찍 정말 초밥 맛집 요 웨이 팅 없으면 매번 집 입니다 ,종로구
1775,평양고깃집,서울 종로구 인사동5길 14 2층,4.5,샤브샤브 비쌈 맛있음 친절 꽤괜  점심 특선 대박 자극 적 재료  반찬 괜찮네요 ,종로구
1776,교대이층집 광화문점,서울 종로구 삼봉로 95,4.1,직원 분 안내 자리 아줌마 직원 자리 반 그 자리 아줌마 표정 저희 다 데 직원 기분 나빴어요 비빔냉면  아이 들 같이 방문 친절하게 좋았습니다 고기 맛있었고요     ,종로구
1777,안주마을,서울 종로구 자하문로1길 3,4.1,내 사랑 안주 마을  사진 못 사장 님 짱 친절 또 게  해산물 본연 맛 살림 신선함 바다 머 금은 식당 임명 맨날 사악한 웨이팅 단점 못 맘 가야 함 ,종로구
1778,에베레스트 레스토랑 동대문점,서울 종로구 종로51가길 2-1 2층,4.3,버섯 카레 제발 제발 제발      지금 커리 중 젤 맛있었다 ,종로구
1779,유진식당,서울 종로구 종로17길 40,3.5,가성 비 좋아요         ,종로구
1780,프릳츠 원서점,서울 종로구 율곡로 83 1층,3,친절하시고 빵 맛있어요       좌석 수 방문객 많아 대기 시간 것 이해 수 있으나 그 사람 들 이 날씨 하염없이 밖 것 영 마음 안드네 커피 이런 불편 감수 볼 한지 저 의문 입니다     ,종로구
1781,영화루,서울 종로구 자하문로7길 65,3.1,웨이 팅할 정도 아니어도 가까이 살 땐 종종 고추 간짜장 탕수육 연태 만  양파 많은데 고기 없다 가격 아깝다  물론 입맛 천차만별 하지만 이 돈 이 맛 맛있다고 분 들 혹시 나 당하기 억울하니 너 한번 이 건가    ,종로구
1782,카페 레이어드 안국점,서울 종로구 북촌로2길 2-3,3,케이크 스콘 맛있는 편 줄 서서 자리 정도 아님 자리 굉장히 협소 무엇 케이크 빵 들 실외 오픈 공간 좁고 사람 들 곳 있어 위생 적 별로 임 가격 사악한 편  정말 맛있습니다 커피 맛 깊이 있네요 동행인 들 감탄 비싸긴하네요  빵 맛있는 게 많습니다 커피 가격 너무 사악합니다 ,종로구
1783,찬양집,서울 종로구 돈화문로11다길 5,3.3,        맛있었지만 미슐랭 기대할 정도 아닌 ,종로구
1784,스미스가 좋아하는 한옥,서울 종로구 삼청로 22-7,3,가게 예쁘고 평일 점심 한적하고 분위기 너무 좋아요   루꼴 피자 좀 뽀모도 파스타 추천  장사 이렇게 직원 관리 제대로 라스트 때 화장실 못 직원 다 청소 있어서 가족 화장실 직원 벌컥 문 청소 도구 뭐 미안하단 말 아무 말 없이 사람 신경 안 본인 청소 도구 결국 옴 이딴 서비스 장사 유지 그냥  분위기 좋은 한 옥 맛있게 즐거운 시간 통창 밖 이보 좋았는데 구석 자리 추웠어요 다음 피자 ,종로구
1785,나누미떡볶이 성대본점,서울 종로구 성균관로 9-1,3.1,오랜 만 가격 사악하게 못    근데 떡볶이 오뎅 여기 소스 국물 개발 메뉴 그렇 김밥 순대 덩달아     원 으로 이건 진짜 선    김밥 진짜 그냥 다른 분식집     원 짜리 기본 김밥 딱 그대 순대 공장 납품 진짜 흔 하디 흔한 순대 여기 다른 비법 있는 것 아닌 평범한 메뉴 다른 곳 몇 천원 씩 더    장사 잘 배짱 영업 하 건가    그리고 여기 오랜 만 시간 변하지 딱 두 가지 있네 간장 지저분한 거 직원 들 불친절한거         떡볶이 때 ,종로구
1786,엄용백돼지국밥 종각점,서울 종로구 인사동3길 20,3.5,직원 분들 진짜 불친절하시네요      오랜 만이 이런 식당     대단하시네요      번창 사장 님 명 심하세요 네            식당 별로 안 그 만이 댓글 같은것도 필요 없는데 꼭 처음 종로 엄용백 때 방문   회 정도는 방문 가격 비싼 편이 맛 나쁘지 특히 고기 좋았습니다 근데 국밥 가격 만천원 만삼천원 맛없는것도 골 거지 그런데 맛 둘째 직원 들 서비스 정신 한참 오픈 초창 기 직원 들 친절했으나 갈수록 불 진철 해지 네 때 마다 직원 들 안 그림 댓글 중 대다수 직원 들 불친절 논 특히 카운터 안경 남성 분 사장 솔직히 자기장 사장 이면 더 열심히 요즘 유행 인스타 감성 카페 같은 느낌 무슨 대단한 음식 판다 인지 질 불친절 어마 초창 기 물 따뜻한 차 주더 지금 냉수 국밥 양도 웨이 팅 시스템 홀 자리는 텅텅 무조건 밖 인스타 성 카페 저 리가 입니다 마지막 안 그 만인 식당 그래도 장문 글 엄용 백 국밥 종각 점 사장 님 개 같은 기분 오래  담백한 맛 입니다 메뉴 있는 백반 보고 세번 때 평일 점심 저녁 안된다 못 직원 분들 좀 짜증 나 마감 시간 한 시간 전 도중 옆 계속 식기 소 리나 정리 불편하게 ,종로구
1787,스코프 서촌점,서울 종로구 필운대로5가길 31,4,그냥 서 촌 때 반 사적 감모 메뉴 맛있다 매장 것 비 추천  스콘 차갑고 질겨 커피 맛있는 것 아니고 매장 깨끗한 것 아니고 대체 왜 사람 북적 의문 다른 건 위생 신경 쓰시 분 들  매장 디저트 가득 요 미국 유럽 가정 디저트 근데 케익 류 다 완전 달달 다 영국 식 미국 식 아닌가요 단 거 좋으신 분 진짜 맛있겠어요 너무 단 걸 못 용기 없었고 결국 비스킷 기본 스콘 택 맛 괜찮아요 특히 비스킷 한국 많이 적 없었는데 딱 칸 쿠키 같이 그 맛 그 맛 맛있어요 스콘 맛있는 데 많아서 굳이 필요없을 뜻 ,종로구
1788,나무사이로,서울 종로구 사직로8길 21 1층,3.9,손님 콘센트 단   개도 허락 의지 좌석 세상 불편 하지만 화이트 크림 맛있다      유명한 카페 방문 항상 만족감 있다 일단 커피 맛 만족스러웠으며 카페 개성 수 있었다 억지로 인스타 감성 따위 아닌 자연 시간 자신 무언가 말 그런 면 한 옥 공간 역시 너무나도 화려한 원두 이름 결국 우리 입 커피 컵 더 집중 한다는 느낌 블렌딩 원두 여러 종이 에스프레소 필터 커피 활용 있었다 블렌딩 통해 지속 적 일관 맛 의도 아닐까 생각 한글 이름 블렌딩 간단한 표기 싱글 오리진 원두 역시 감각 적 직관 적 경험 중시 나 생각 일지 ,종로구
1789,어니언 안국점,서울 종로구 계동길 5,3.5,맛집 도배 반신반의 그냥 딱 인스타 맛집 입니다 불향 화유 직접 불향 아니구여 파전 눅눅합니다 바삭 파전 아니네요 광고 줄 너무 재 방문 안 같아요      한번 정도 타이밍 웨이 팅 정도 아님 만해 간도 파전 맛있어요 근데 파전 안 순 없고 반    ,종로구
1790,노티드 안국,서울 종로구 북촌로 6-3 1층,3.3,    가격 얘기 분 들 그냥 저렴한 곳 친절하고 기본 이상은 고기 집  삼겹살            원 소주 및 맥주     원 ,종로구
1802,이경문순대곱창,서울 종로구 돈화문로11나길 5,3.8,맛있어    술 못 하 데 소주 세잔 정도 맛  너무 맛있어서 기절  여기 스타트 날 그냥 끝 간다 ,종로구
1803,차이797 광화문점,서울 종로구 새문안로5길 31 센터포인트 광화문빌딩 2층,3.7,    해물 볶음밥 생쌀임 잡채 밥 간이 삼삼 바 로우 고 기 딱 딱  데이트 코스 개인 적 표고 딤섬   점 짜장 짬뽕 최고   ,종로구
1804,촌놈,서울 종로구 대학로8가길 48 연경빌딩 2층,4.1,위치 달라   번 출구 바로 오른쪽 맥도날드 뒷 편 있음 카카오 맵 준 위치   번 전화하고 참고  젊은 친구 들 친절해서 흐뭇하네요 고기 맛 다 나오니 힘안 들   고사리 김치 치즈 밥 든든함  솔직 후기 일단 직원 분들 친절하 심 그리고 음악 시끄러 움 그냥 호프 집 느낌 고기 생각 별로 추천 메뉴 비계 잔득 오래 고기 줌 너무 양 작아서 삼겹살 시킴 엄청 안   인분     그람 양 비계    프로 임왜 비계 엄청 많아 메뉴 특수 부위 아마 부위 같음 비계 덩어리 개비 추임 ,종로구
1805,포비브라이트 광화문점,서울 종로구 새문안로 76 1층,4.2,직원 분들 너무 친절하세요       커피 맛 일품 입니다 베이글 깊은 맛 있어 좋았습니다 자리 널찍하고 모두 들 친절합니다 정성 들 시 다모 향 기 카페 주변 갤러리 많아서 더욱 좋습니다  허니 밀크 베이글 무화과 크림 치즈 플랫 화이트 라떼 환상 조합    맛 힐링 ,종로구
1806,평창동북악정,서울 종로구 평창36길 6,3.8,저 어머님 어르신 들 좋아하셔서 고기 곳 항상 북적 거리 손님 들 많네요 분위기 깔끔하고 손님 들 좋아요  고기 질겨 서비스 안좋아요 양은 비싸요 직원 고기 노팁 있는데 팁 그런건 아닌가 질 기지 갈비 맛 너무 달 좋아요 냉면 된장찌개 맛있어요 신관 창가 자리 평창동 전망 좋아요 신관 지하 주차장 넓지만 번 회전 건 어렵고 때 차가 해 튱로 좁아서요  여기 원래 이렇게 맛있었나요 예전 점심 정식 저렴한 걸 로만 그래서 맛 차이 가요 아무튼 맛있게 ,종로구
1807,부산회집,서울 종로구 돈화문로4길 38,4,회 지리 미역국 진짜 맜나  여자 넷이 모 듬 회중 자 적당히 잘 밑반찬 다른 메뉴 필요없고 미역 지리 미쳤어요 미역 호로록 이 것 별미 없음 근데 네 명 방문 딱인듯   두 명가 가성 비 같아요  비싼게 흠 ,종로구
1808,사발,서울 종로구 사직로8길 34 경희궁의아침 3단지 1층 142호,3.5,닭개장 국수 진짜 맛있어요   연어 밥 가격 대비 훈제 연어 평범했고 떡볶이 평범했습니다 그런데 분위기 좋고 에피타이저 호박죽 반찬 들 맛있어서 닭개장 국수 엄청 분 닭개장 국수 강력 추천 이  분위기 인테리어 좋아요 근데 좀 어수선해요     ,종로구
1809,청수정,서울 종로구 삼청로 91,3.3,바닷가 식당 홍합 가득하고 농가 식당 나물 반찬 가득합니다 이 가격 집 이렇게 못 맛있게  유명하다고 청와대 깔끔하고 맛있네요 옛날 분위기 수 있었네요 어른 들 모시 가기 좋았어요 부모님 좋아하셔서 다음 또 정식 가장 맛있고 비빔밥 홍합 밥 특이하더라구요 근데 좌 식 다리 아팠어요    그거 음식 맛있었어요  일단 깨끗해서 때 기분 좋았습니다 정갈한 음식 고소한 홍합 밥 어르신 두 분과 같이 식사 너무 좋았습니다 만약 제 다시 어르신 모시 간다 정식 파전 주문 ,종로구
1810,인사동수제비,서울 종로구 인사동8길 14-1,4.1,굴 안 좋아하는 사람 파전 좋아할듯 굴 수제비 솔직히 시장 수제비 그 이상 이하 아님 근처 수제비 처럼 감자 바지락 기대하면 안됨  들깨 얼 수제비 파전 딱이에요 최애 수 제비집     매년 점점 맛    년 전 쯤 파전 겉 바삭 속 포실포실 정말 맛있었음 들깨 수제비 진득 짐 그 자체 근데 이제 미적지근하고 속도 덜 파전   들깨 국물 묽고 연해 짐 간도 좀 참고 매콤 수제비 정말    ,종로구
1811,도트블랭킷,서울 종로구 윤보선길 22 1층,4.2,새우 중국 식 양념 양념 더 맛있게 과카 몰리 같이 깔끔하게 느낌 오픈 런 해도 웨이팅 있는거 같으니   분 전 쯤 추천  최근 브런치 중 체고 체고  불금 저녁 자리 많더라구요 음료 안 파스타 샐러드 진짜 맛있었어요 친구 아보카도 베이컨 샌드위치 입 접시 뻔했네요 ,종로구
1812,이태리재,서울 종로구 율곡로1길 74-9 1층,3.5,전반 적 다 맛있는 편         ,종로구
1813,버거파크 혜화점,서울 종로구 대학로11길 5 1층,4.4,버거 상당히 맛있다 녹진한 치즈 부드러운 패티 최고 조합 많은 수 제 버거 집 들 중 꽤 괜찮은 듯      햄버거 안 좋았습니다 맛 평균 이 상이 네 ,종로구
1814,호반,서울 종로구 삼일대로26길 20 1층,4,영원한 내 사랑 더 더 사랑 텐데  소주 및 맥주     원     ,종로구
1815,들풀건강한밥상 청운동점,서울 종로구 자하문로 118,3.3,최고 맛집  반찬 하나 하나 정성 듯 촉촉하고 맛있어요 돌솥밥 맛있구 주차 완벽하면 좋은데 종로구 이해해 듯또 곳    서울 송이 솥밥 가성 비 괜찮은 건강한 밥상 모든 반찬 들 맛있고 역쉬 조미료 안 진정한 순수 맛집   다만 예약 주차 미흡하네요 ,종로구
1816,편안한집,서울 종로구 북촌로 133,3.6,깔끔하고 맛있네요 근데 음식 너무 빨리  둘 난향   인  만원 없다는 부실     ,종로구
1817,더키친750,서울 종로구 대학로8가길 80 2층,4.1,음식 조금 맛있었어요 오픈 런 키 오스 기능 좋고 직원 분들 친절하셨어요         ,종로구
1818,명동닭한마리 본점,서울 종로구 종로40가길 14,4.1,맛 있는데 직원 왜케 불친절한지 그리고 부추 다 옆 냅다 정리 좀 아니라고 저희 마감 시 간전 아니고 오후    시 사이      어이 없었네요  닭 한 마리 국물 깔끔하고 맛있어요 칼국수 칼국수 꼭 함 면 적당히 얇고 쫄깃해 맛있슴다  맛있었어요 칼국수 특히 맛있네요 ,종로구
1819,박순례손말이고기 산정집 광화문점,서울 종로구 새문안로5가길 3-10 선덕빌딩 2층,2.9,흑 흑   허탕  둘이서   인분 찌 클리어 채소 즙 향 맛 완전 완벽함 찌개 좀 고기 비 그냥 그냥 맛 하지만 다시 가면 또 찌개 듯     아무튼 개존맛       고기 좀 같은데 맛있게 잘 달달 불고기 맛임 된장찌개 편 그래서 같이 먹기 좋다 서버 분들 친절하 심 재 방문 목요일 다섯시 방문   번 째 입장 함   점 좀 아쉽지만   점 대 아니지 ,종로구
1820,은성횟집,서울 종로구 창경궁로 88 광장시장 45-1호,3.3,대구 탕 맛집 어수선하고 삼각지 대 구 탕집 비교 가성 좋은데 아쉬움  광장시장 가면 항상 알탕 입니다 짝수 주문   인분   인분 가능하며 알 고니 많아서 좋습니다   가성 비 좋음   알 고니 많고 맛 무난 히 맛있습니다 주말 웨이 팅 하 곳 추천  광장시장 길 바닥 자고 여기 술 없음 ,종로구
1821,창화당 익선동점,서울 종로구 수표로28길 23,3.4,로 제 떡볶기 너무 맛있어요  갈비 만두 진짜진짜 맛있음  익선동 있기까지 창 화 당 역할 정말 지짐 만두 떡볶이 조합 매번 맛 입니다 다만 만두 구성 트러플 만두 제일 아쉽고 떡볶이 쫄면 같이 끝내주는 창 화 당 입니다 ,종로구
1822,하림각,서울 종로구 자하문로 255 1층,3.2,여기 진짜 맛있는데 중식 당 많이 가족 식사 좋고 오렌지 크림 새우 대 존맛 입니다 꼭 아 굴탕 면도  과 가격 터 무니 없는 맛 양  느끼해요 ,종로구
1823,원조누드김밥,서울 종로구 창경궁로 88 광장시장 41호,3.9,    이 가격 이 정도 만족합니다  가성 비 중요함 정신없이 비위생적 곳 상관없다 그럼 추천 ,종로구
1824,공평동꼼장어 본점,서울 종로구 우정국로 29,3.4,  차 백부 장집   차 공평동 꼼장어 입지 그냥 국가 정 룰         ,종로구
1825,종로설렁탕,서울 종로구 종로 110,2.7,모 리뷰 평 사장 님 여자 분 좀 퉁 명 느낌 불편할 정돈 아닌듯 일 분 들 좀 많이 바쁜 느낌 테이블 위생 상태 신경 으   고추 가루 찌꺼기   이 물질 등   좀 그랬음 티슈 두 번    개인 생각 금액 좀 다운 양 좀줄여도 좋을듯 너무 많음 김치 깍두기 설렁탕 집 맛 그 닥 듯   오징어 젓 맛있음        명가 먹기 가성 좋을듯 한 집  모듬수육전골 기대  맛 좋음 돈 없는      고기 없다고 임 별 점 테러 놈 들 휴    괜히 걱정 맛없을까봐 너무 맛 먹음 ,종로구
1826,부암동스코프,서울 종로구 창의문로 149 1층,4,워낙 유명해서 특별할 것 없는 맛 실망했습니다 그래도 번 쯤 해      이 동네 살 때 자주 빵집 빵 그다지 좋아하지 습관 ,종로구
1827,한일관 광화문점,서울 종로구 종로1길 50 더케이트윈타워 A동 지하1층,3.2,    가성 비 창렬 근데 맛 좋음 우두머리 들 머 비싼 거 때 가기 좋음     ,종로구
1828,청계천휴,서울 종로구 청계천로 71 계원빌딩 1층,2.7,무례함의 끝판 왕 화장실 때 때 다르다고 손님 그냥 호구 봄 기분 나쁜 경험 가세  무례한건 그렇다 맛 좋으면 좋은 기억 음식 양도 다른 곳 전부 비싸게 느낌 너무 가성 비 별로 그리고 사람 무시 느낌 안  만족 스포츠 경기 있는 날 가면 좋은 곳 안주 맛있다 ,종로구
1829,천하보쌈,서울 종로구 창덕궁1길 8 천하보쌈,4.2,굴 보쌈 맛있고 반찬 맛있는데 친절하시기까지 하니 인생 보쌈 집 부족함 없습니다  고기 야들야들하구 반찬 맛                             친구 외국인 한국 음식 소개 간 건데 민망하고 미안할 정도 불친절했습니다 남자 직원 들 가게 안 아무 주문 안 본체 체 계속 접시 탕탕 너무 불친절해서 눈치 직접 앞 접시 무뢰한 같은 태도 무엇 외국인 친구 우리 뭐 잘못 거 있냐고 정도 엄청난 서비스 게 아니라 기본 적 매너 말 거 불쾌한 경험 ,종로구
1830,남대문막내회집 광교점,서울 종로구 우정국로 4-1,4,맛집 회 두껍고 같이 음식 이 걍 대박 임  대 방어 하니 방어 부족해서 모듬 방어 온 거 그냥 대 방어 주문 가능한지 주방 확인 후 수량 부족하니 그냥 모듬 양 크게 부족하진 막내 회집 특유 두툼 식 괜찮았지만 사진 모두 한번 보시 중간 빡쳐서 사진 거 양 상태 확인 대체 어느 회집 방어 주문 저런 수준 회 겁 기존 리뷰 뒤늦게 확인 제 잘 못    위생 분위기 그냥 회감 자체 기본 적 퀄리티 대해 만 논 정말 아닌거 같습니다 이럴거면 아예 방어 주문  방어 포함        원 맛 없고 양도   몇 젓가락 ,종로구
1831,종로찌개마을,서울 종로구 삼일대로30길 10-4,3.2,맛있어요 보기 안 엄청 꼬소 밥 반찬 술안주 도 좋은 맛 입니다 인스타 유명한 집 그런지  시 쯤 때 이미 앞     팀 있었고 사장 님 너무 바쁘고 힘들어서 혼  영업 시간 왜 정 재료 준비 안되었다고   시 에 오라 기분 나빠서  젊은 남자 사장 너무 싸가지 없음 손님 뭐 암 맛 안감 ,종로구
1832,창신동매운족발 본점,서울 종로구 종로51길 23,3.7,늘 미리 전화 주문 포장 있는데 주문 외국인 여자 분 정말 의사소통 너무 잘 친절하세 요가 성비 너무 좋고 맛있어서 족발 때  매우 맛있음 엄청 엄청 아님 위생 많이 안좋음  평타 침 일부러 정도 아니지만 안나 충분히 맛있음 ,종로구
1833,도토리브라더스,서울 종로구 경희궁길 41 1층,3.5,    맛 가격 비싸긴한데 맛 있어요  시금치 파스타 괜찮아요 대창 밥 가격 맛 아쉬웠어요 분위기 좋아서 데이트 코스 좋을거 같아요 ,종로구
1834,하나로회관,서울 종로구 인사동5길 25 하나로빌딩 지하1층,4,맛있는 한정식 집 때 꼭 곳 친구 들 정기 적 곳 항상 변함 없는 맛 정갈한 뒷맛 기분 좋은 집 갈비찜 잡채 샐러드 등 고루 고루 만족도 높은 집  갈비찜 방문 식사 후 바로 리뷰 깜박 이제 음식 맛 전체 적 깔끔하고 자극 적 좋았어요 다만 대식 가인 저희 양 조금    메인 메뉴 있고 사이드 있는 개념 여러가지 음식 조금씩 구조 메인 정 한가지 집중 더 좋을거 같아요   번 식사 준비 반찬 밥 같이 조금 더 든든했을듯 한데   번째 상차림 때 약간 아쉬웠어요 그리고 후식 주신 식혜 정말 맛있는데 저희 그날 식혜 맛 조금   그래도 맛있다고 생각 따로 식혜 맛 그날 약간 문제 있었나 방 따로 조용히 식사 수 있는게 최고 장점 요 시끄러운거 싫어하고 조곤조곤 대화 스타일 딱 안성맞춤 혹시 아쉬웠던 부분 개선 재 방문 의사 백프롭니  얼마 전 미국 사촌오빠 부부 평소 맛있고 가성 비 최고 생각 하나로 회관 귀한 손님 부족함 없이 대접 마음 전달 것 정말 흡족한 식사 하나 하나 다 맛 좋고 다른 곳 맛보기 어려운 다양한 메뉴 두 분 마음 샐러드 또한 산뜻한 맛 그 곳 모시 고간 나 거듭 감사 말씀 전 다그 몇 주 전 입양 기관 봉사 알 미국 입양 분 때 하나로 회관 감사 말 귀한 손님 함께 하나로 회관 그 때 마다 만족 식사 발걸음 가벼웠다 ,종로구
