no,name,address,review_star,review_text,gu
1,하누소 창동본점,서울 도봉구 노해로 327 5층,2.2,이 곳 가장 문제 서비스 따위 나빠도 손님 많다고 생각 한 직원 들 태도 맛 논 기본 적 마인드 굉장히 불쾌한 곳 특히 줄 있는 경우 당장 다른 식당 추천 원래 직원 들 응대 형편 없지만 바쁠 때 거의 구박 수준 오늘 이후 두 번 다시 일 없다  우거지 갈비탕 달랑 뼈 세 개 그 중 하나 기름 범벅 갈비탕 집 갈비탕 만두 훨씬 맛있는 곳  냉면 맛 늘 냉면 파가 파맛 안나 육수 좀 당황 ,도봉구
2,동적불고기&깡통구이 쌍문점,서울 도봉구 도봉로109길 30 1층,4.5,희한하게 최근   점주 신분 들 후기 여 기만 있네 옇    낮 방문 사람 많음 그만큼 유명하고 맛있다는 이야기 근데 서비스 이 많이 아쉬워요 고기 제외 다른건 더 달라하거나 해도 진짜 계속 말    진짜 구차하게 이 거 내 네다섯 번 말 돈 고기 술 빨리 빨리     반찬 뭐 더 달라 그러면 세네 번 말 겨우 까말까 한            밥 먼저 뻔 고기 환 기구 엄지 손톱 만 검정 기름 때 불판 뚝           위생 서비스 신경안 편이 맛 생각 가도 한 집  몇 년 변함 없이 진짜 맛있네요 메뉴 많이 갈비살 여전히 맛있고 등심 부드럽네요  양념 소 갈비살 청국장 명품 요    냄새 안나 맛 도리 입니다 직원 분들 너무 친절해서 기분 좋은 한 끼 강추 왕따 봉   ,도봉구
3,대문,서울 도봉구 시루봉로 139-6,3.6,룸타입 입 식 식탁 어른 모시 오기 좋네요 나물 슴슴 게장 보리 굴비 다 맛 요 서빙 여사 님 친절하세요 밥 양 더 기도 주말 사람 들 대기 바쁘던데 맛집 봄  네이버 블로그 보고 가지 음식 특색 없고 카운터 남자 분 불친절해 다시  맛있어요 보리 굴비 특히 뼈 발라 좋구 잡채 맛있고 코스 아주 조 처음 계절 죽도 맛 ,도봉구
4,무수옥,서울 도봉구 도봉로165길 15,3.2,서비스 불친절 맛 별로 정도 아니라 그냥 무맛 소금 맛 시설 좁고 오래됨 다 감수 맛 없고 음식 정성 없음         ,도봉구
5,쌍문동판다쓰,서울 도봉구 우이천로24길 49 1층,4.1,존맛 친구 들 가기 좋아요  어 향가 새우 맛있어요 다른 가게 어 향가 새우 소스 들 간장 맛 강하고 칠리 맛 다소 약한 느낌 간 상당히 강해요 새우 탱 글 가지 두께 좋아요 샤 오기 처음 신기하고 독특했어요 중국 식 냉채 샐러드 같아요  맛있음 분위기 좋음 비쌈 ,도봉구
6,동해수산,서울 도봉구 도봉로 663-8,3.8,직원 분들 모두 친절하고 음식 다 맛있어요 서비스 잘 감동    모임 있을 때 좋을 거 같아요  친절하 심 부모님 모시 외식 좋음  가성 비 별로 ,도봉구
7,수정궁,서울 도봉구 방학로 173,3.6,    사장 님 바 필 감산 쉐프 취재 못  사장 님 평범합니다 ,도봉구
8,메이다이닝,서울 도봉구 도봉로169길 202,3.4,맛있어요 파스타 스테이크 훌륭해요 파스타 좋아하는데 리얼 파스타 전문점 다음 룸 미리 예약      마르 리타 피자 맛있었어요 프로슈토 피자 햄 두껍고 질겨 프로슈토 아니라 하몽 그런 생각 그 외 뒤쪽 정원 너무 아름다웠네요 다음 또 방문 ,도봉구
9,옹기꽃게장,서울 도봉구 도봉산4가길 14-9 1층,3.3,한 상차림 충분히 배부르네요 맛 없네 어쩌 말 많은데   인       원 이라는 가격 좀 염두 리뷰 잘 저 양념 간장 더 괜찮았어요  수저 그릇 뭐 그냥 맛 있는데 너무 안좋았어요     가성 비갑 한 상차림    ,도봉구
10,삼오집,서울 도봉구 도봉로165길 4,3.2,맛있음  김 이런질 소 곱창 처음 봄  버닝 스티븐 연 서울 제일 맛있는 곱창전골 영화 간판 보고 꾸역꾸역 집 굳이 멀리 만족스러웠음 ,도봉구
11,소도둑 도봉동점,서울 도봉구 도봉로 909 1층,4,무한리필 이 퀄리티  무한리필 고기 좋고 부드러워요 숯불 더 맛있네요  제 무한리필 중 제일 좋은 퀄리티 고기 ,도봉구
12,스시혼 창동점,서울 도봉구 도봉로110길 8,3.3,초창 기 스시 혼 생각 초심 많이 듯        일본 나름 초밥 좀 여기 맛있는 집 드문 것 같음 방금 문득 다시 생각 포장 서비스 없으므로 매장 식사 추천 ,도봉구
13,마쯔무라돈까스 본점,서울 도봉구 노해로63길 84 지하1층,4.3,너무 좋음 고기 질 좋고 부드럽고 맛있고같이 온 치킨 살 기 대안 맛있어서 놀람 돈까스 한판 자체 다 솔직히 힘든데 다 수 있을 정도 맛있었다  역시 마쯔무  창동 명물 이 가격 이 퀄리티 진짜 최고 ,도봉구
14,묵은지사랑,서울 도봉구 도봉로164길 38,4.3,얼마 전 가성 비 좋고 맛 무난 좋은 식당 하지만 최근 방문 경 영진 의심 정도 서비스 변했고 밑반찬 맛 예전 같지 바로 조리 음식 같지 음식 느낌 생선 구이 그 전 갓 구 은 고소함이 있었는데 오래 방치 생선 구이 느낌 입니다 그리고 한동안 배추 값 비싸져서 그런 것 하지만 반찬 묵은지 기 본 찬 더 이상 안 아쉬움 더합니다 어떤 식당 초심 유지 것 힘든것이겠죠    점수 기준 표   동네 기준   개 일부러 간다   개 맛있다 자주 만하   개 적당히 때 한번 씩 간다   개 재 방문 그닥   개 이 음식 컵라면 회사 근처 젤 괜찮은 맛집 가성 비도 좋음  꼬막 정식 가격 착하고 양도 많고 맛 좋습니다   인 이상 방문 선택 폭 좀 제 게 간이 좀 살짝 아쉽지만 다시 방문 지인 들 추천 ,도봉구
15,삿뽀로 창동점,서울 도봉구 도봉로 610 2층,2.2,왜 스시 와사비 그렇게 잔뜩 거 그냥 와사비 거 같았어요 매워서 기침 난리 또한 비싼 돈 퀄리티 다 아쉬워 제 다 부끄러웠습니다  점 장 시작 서비스 정신 제로 영수증 처리 하나 제대로 못 손님 탓 죄송하다는 말 어려운지 실실 쓸데없이 사람 스트레스  흠 음식 질 종업원 교육 아쉽네요 ,도봉구
16,호호분식,서울 도봉구 도봉로121길 32,4.3,카드 수수료 때문 계좌 이체 그런데 현금영수증 안되는건 탈세  두 번 방문 함 치즈 밥 젤 존맛 이구 탕수육 가성 비 괜찮았어요 라면 개인 적 신라면 느낌 좋아하는데 안성탕면 같은 느낌 치즈떡볶이 계산 때 맛 괜찮았는지 좋았어요  치즈 밥 맛있고 쫄면 맛있음 떡볶이 걍 그렇고 탕수육 낫 마스 ,도봉구
17,신화푸드빌리지 서울창동점,서울 도봉구 도봉로 526 2층,3.3,여기 쓰레기 동생 생일 기분 좋게 아주머니 들 계속 얼 알바생 다 백김치 신경 안 물 다 옷 가방 젖 뻔 사과 안 저녁 시간 영업 더 차도 없고 주차공간 많은데 카페 차 빼 닥달    아니 우리 매상 게 얼마     손님 들 눈치 똥 서비스 맛 좋으면 뭐 하나 서비스 똥  평이 극 과극 반신반의 역시 주차 편리한 거 일단 벽면 메뉴판 메뉴 수 없다면 좋을 것 같고 엄마 모시 음식 값 서버 분 서비스 너무 안좋아서 바쁘지도 무언가 요청 대답 안 사람 무시 아니고 기본 적 응대 음식 맛 걸 개선 필요해  반찬 하나 하나 맛있고 직원 들 친절하시고 고기 주심 가격 괜찮아요 아주 만족했어요 ,도봉구
18,황금정원,서울 도봉구 방학로 312,2.9,           엄니  배민 너무 맛있어서 방문 돌솥밥 매력  별하나 아깝다 같은 같은 가격 백운호수 백 운 재는 놋그릇 반찬 무한 리필 쌈 유기농 생수 카페 있는데 황금정 원 반찬 추가 돈 날 강도 느낌 제육   인분 접시 바닥 진심 주인 장 백 운재 보고 오라 내 홍보 아니지만 같은 가격 대 너무 접 비교 그런다 안 간다 위 사진 백 운 재임 ,도봉구
19,도봉산양고기,서울 도봉구 도봉로191길 99-6,2.7,예약 후 방문 양고기 맛있고 반찬 들 하나 하나 다 괜찮네요 면 야외 자리 다시 방문  사람 많으니 여유 있게 가야 함  사람 무척 많은데 그걸 감당 깜냥 안되는 식당 입니다 우리 주문 테이블 같은 메뉴 먼저 제공 주문 메뉴 우리 오기 한 시간 사십분 첫 메뉴 하다못해 공기밥 두 시간 이 모든 기다림 맛 아닙니다 ,도봉구
20,천지연 서울창동점,서울 도봉구 도봉로 526,3,금일 장모님 와이프 처제 세명 이 기본 적 서비스 아예 없다고 저 도 그렇고 주변 서비스 직 많아서 보통 항상 즐겁게 편 정말 최악 처음 입구 맞이 분만 친절하고 그 외 서빙 사람 들 두 분 응대 전혀 그냥 초등학생 들 못 기본 수준 못 사람 들 일 같다고 저 그런 적 없는데 처음 구체 적 하나 말 반찬 머리카락 설명 후 달라 한마디 무전 이 거 한마디 보통 아니더라도 미안하다 한마디 보통 아닌가요 사회 성 없는 분 들 일 하나 무 일이 없을거 같구요 분 들 이 거 꼭 보시 그런거 세상 쿨하신 분 들 가세 카카오 리뷰 처음 네이버               리뷰 별 점 항상 만점 사람 입니다  로비 약  시간 대기 후 음식점 주문 음료 먼저 반찬세 팅 없이 또 한참 그 후 고기 반찬 함께 고기   인분 모조리 불판 뒤 조금 달라 원래 이렇게 라며 다 결국 다 그릇 차라리 것 기본 적 주문 더 낫 벨 아무 반응 없고 번 더 도안 또 한참 직원 그때 주문 띵동 소리 테이블 번호 아무 안 그럼 벨 의미 있나요 또 옆 리 필통 있어 직접 라며 제지 아니 얼 밥 직원 식당 분위기 때문 기분 곳 처음 요  처음 직장 회식 자리였고 조용하고 넓은 자리 분위기 좋았지만 서비스 직원 들 말투 귀    고기 직원 대충 덜 고기 급하게 입속 물컹거 맛 고객 건성 계산서 확인 안 옆 테이블 자리 술   병값 지불 뻔 ,도봉구
21,트라토리아진,서울 도봉구 도봉로110길 39-16 1층,4.3,굿 베리 굿  가격 대비 가성 비 좋은 건 파스타 기본 재료 들 없었고 새우 사이즈 약간 크림 소스 그냥 묽고 왜 맛집 추천 의아     ,도봉구
22,방학사거리짬뽕집 본점,서울 도봉구 도당로27길 22 1층,2.6,    비쌈  오징어 짬뽕 집 국물 시원 맛있습니다 ,도봉구
23,사이코우스시 쌍문점,서울 도봉구 방학로7길 99,2.8,제 근무 곳 늘 회식 장소 애용 곳 입니다 가성 비 갑 사람 많을 때 음식 단점 있지만 이런 평가 곳 아닙니다 저 평가 분 들 나름 이유 있으시겠지만 억지로 거 좀 화가 글 이 동네 사람 들 다 맛집 입니다 사장 님 좋은 음식 번창    주문 잘 못 메뉴 하나 그래도 맛있음 직원 들 다 어리바리 신입사원 씨 듯 최근 나가사키 짬뽕 소스 비닐봉투 처음 응대 직원 사과 안 그릇 그냥 나중 온 다른 직원 사과 음식 다시 음료 서비스 이미 음식 쓰레기 기분 상해 차라리 환불  왜 다 캘리포니아롤 초밥 맛 없네요 생선회 물컹물컹 젤리 근데 왜 이렇게 사람 많은지 이해 ,도봉구
24,채랑,서울 도봉구 도봉로 465 1층,4.2,  년 되가는곳 프랜차이즈 들 야채 양도 훨씬 짐 맛있어요 갓난아기 힐 수 있는 의자 있어서 때 편하게 밥 수 있어 좋습니다  맛있게  너무 맛있구요 반찬 류 또한 맛있고 다양하더군요 사장 님 직원 분들 친절하셔서 기분 좋은 저녁 번창 ,도봉구
25,쭈꾸미킹 쌍문점,서울 도봉구 도봉로 425 1층,2.8,진짜 불친절     퇴근 바쁜 사장  사장 님 같은 분 그냥 모든 사람 말 대꾸 안함 손님 싫어 보임 ,도봉구
26,함스브로트과자점,서울 도봉구 도봉로 483,3.9,맛있어요 또 담 거 근데 빵 쟁반 종이 테이프 종이 계속 재사용 거 같더라고요 그래서 미 포장 빵 담 때 찝찝했습니다 그냥 새 종이 쟁반 위 더 좋았을듯  마늘빵 추천 양파 베이글 추천 버터케이크 초심자 들  티라미수 케잌 맛있습니다 ,도봉구
27,더차우,서울 도봉구 노해로63가길 101 신도브래뉴1차아파트 상가동 201~203호,4,다양하고 가격 적당 하지만 맛 없었음  평일   시 반 웨이 팅 있어서 튀김 찹쌀 탕수육 크림 다 맛있고 소스 들 무엇 하나 맛 죽지 다 기대 안 게살 스프 간이 자장면 기스면 평균 이상 맛있었습니다     ,도봉구
28,쌍문각갈비탕,서울 도봉구 노해로 180 1층,4.2,맛있다는 리뷰 보고 일부러 포장 집 본 결과 글쎄요 사람 입맛 다르긴 하지만 아마도 맛있다고 신분 여기 관계 분 아닐까 요 걍 보통 입니다 맛있지도 아주 맛없지도 특 갈비탕 전복   나 만칠천오백원 전 다음 안 읍니  같은 가격 매장 밥 포장 밥 추가 주문 왜 그런지 이해 힘든 곳 요  맛집 국물 다르다 ,도봉구
29,통나무집,서울 도봉구 노해로60길 99,4.1,잘 반찬 너무 맛있    때 좋았는데 지금 그냥 그럼  직접 손질 고기 정말 맛있습니다 반찬 자주 ,도봉구
30,북새통,서울 도봉구 덕릉로60길 54,4.7,생 갈비 진짜 맛있다 이 가격 이 맛 양념 무조건 생 갈비  아주아주 맛있네요 생소 갈비살   인분 뚝딱  맛있어요 ,도봉구
31,카페작약,서울 도봉구 도봉로118길 10 2층,4.4,에그타르트 아메리카노 환상 적 조합 새해 첫날      해 주시 어 고맙습니다 다시 만점            오늘 카페라떼 너무 실망           층 면장 우동 보고           그냥 오늘 다시   층 단단하게 있었습니다 커피 맛있고 주신 쿠키 달콤하고   써비스 주 신 커피 너무 행복합니다 마침내 단골  커피 너무 맛있어요 드립 백 최고     ,도봉구
32,면장우동,서울 도봉구 도봉로118길 10 1층,4.2,        기대 안 진짜 맛있어요 면 엄청 탱글탱글 쫄깃 우동 다 우동 생각 저 반성 ,도봉구
33,도봉산두부,서울 도봉구 도봉산길 65-5,4.4,맛있어요 위 작아 슬퍼요     반찬 맛있어서 밥      등산 후 진짜 맛있었음 청국장 세트 아닌 청국장 먹음   차 술 맛 ,도봉구
34,창동숯불돼지갈비,서울 도봉구 노해로63다길 17,3.3,이집 이모 님 친절하시고 다 참나물 좋구요 돼지갈비 완전 맛 요 굿         ,도봉구
35,비스트로슬로우,서울 도봉구 방학로 169 2층,4.2,이 동네 제일 맛있어요  분위기 올 드 한 데 셋트 메뉴 너무 맛있어요  정말 별로   분위기 좋아요 스테이크 소스 최악   ,도봉구
36,찌마기 창동점,서울 도봉구 마들로11가길 13,3.4,    두번째 방문 입니다 사장 님 불친절한 걸 알 오니 오히려 그럭저럭 친절 대신 직원 분들 앞치마 등 친절하게 대해 샤브샤브 사리 안주 등 추가 많으니 조개찜 처음 머릿수 많이 주문 곤란합니다 생 새우 산낙지 가리비 모두 정말 싱싱하고 맛있습니다 칼국수 사리 날 계란 채소 무한리필 꼭 추천 매장 내 와이파이 별 한 개 주차 힘들어서  주차 때 때 없음 입구 컷 빠염 ,도봉구
37,와겐커피 방학점,서울 도봉구 도봉로150마길 15,2.3,주차 가능하지만 커피 맛 없어요  반려동물 출입 안된다면서 사장 여자 커피 음식 조리 실 내부 본인 반려견 있음 나중 사진 구청 신고 예정 임 암튼 여기 근처 카페 왠만하면 근처 스타벅스 투  셀프 시나몬 가루 야하는 카푸치노 ,도봉구
38,할머니토스트,서울 도봉구 덕릉로60다길 15 1층,4.6,할머님  년 전 고인 명복      웅 유튜브 토스트 피자 맛집 ,도봉구
39,소통애 본점,서울 도봉구 도봉로136가길 73 북한산한신휴플러스아파트 104동 1층 104호,4.5,굿 이런 분위기 좋아 맛 좋아         ,도봉구
40,도레미즉석떡볶이,서울 도봉구 삼양로144길 18,3.8,    맛있으면 장땡 지금 중     ,도봉구
41,뚝배기칼국수,서울 도봉구 도봉로 683,4.3,  점수 기준 표   동네 기준   개 일부러 간다   개 맛있다 자주 만하   개 적당히 때 한번 씩 간다   개 재 방문 그닥   개 이 음식 컵라면 적당히 때 한번 가면 한 데     개 적당할듯  국물 시원함 뜨끈하니 괜찮았음 김치  들깨 수제비 감자 만두 맛있어요 ,도봉구
42,홍방원,서울 도봉구 도봉로169나길 47,4.1,맛 좋은 편이 일부 식사 류 저렴한 편이 집 거리 좀 정기 적 곳  이제 맛 보기 힘든 얼마 없는 간짜장 맛집 이 그리고 탕수육 옛날 스타일 주 기적 방문 맛집 입니다       간짜장 맛있다는 이야기 맛있었어요 오래된 가게 테이블 수 저 통 오래된 것 끈 적임 없이 너무 깨끗해서 더 마음 ,도봉구
43,산도토리임자탕,서울 도봉구 덕릉로60길 13 1층,4.5,요즘 같은 날 맛  임자 탕 쫀득쫀득 도토리묵 맛있어요     ,도봉구
44,쌍문동커피,서울 도봉구 도봉로116길 5 1층,3.8,    분위기 좋지만 자리는 불편해요 커피 그럭저럭  동네 예쁜 카페 지하 곱등이 목격 ,도봉구
45,은행골 도봉점,서울 도봉구 마들로 684,3.3,        초심 참치 두께 크기   수렴 중 ,도봉구
46,코노하,서울 도봉구 우이천로20길 7 건영아파트 상가 103동 1층 118호,4.3,인생 카레 맛집 카레 이렇게 맛있을 수 있구나를 곳 입니다 혼밥 좋고 데이트 좋아요 사장 님 친절하시고 진짜 동네 맛집 개존맛 맛집 입니다  인스타 성 일본 식 카레 돈까스 가격 대비 고기 얇은 편이 아쉽네요 카레 밥 리필 가능해서 좋아요 식전 감자 너무 맛있고 사장 님 직원 분들 모두 친절하셔서 좋아요 평일 런치 웨이 팅 있습니다    회전 율 좋은 식당 아니여서 아쉬워요  사장 님 친절하시고 밥 양 생각 밥 카레 리필 가능하다고 맛 좋고 다시 같아요 ,도봉구
47,삼성숯불갈비,서울 도봉구 도당로 36,3.5,돼지갈비 지존 이  이 쓰레기 매장 예전 알바 두 놈 이 나 희 희 덕 거리 던거   년 도 더 나름 트 라우 갑자기  점심 시간 냉면 갈비   인분 오 자마자 사람 많았습니다 너무 맛있게 잘 ,도봉구
48,짱나라24시해장국,서울 도봉구 도당로 55,4.3,위생 안좋은 것 같아요 뼈 귀 건 순 대국 이건 떡 만두국 이건 이집 밥 배 바로 아픕니다      갓 성비 메뉴판    년 전인 줄 요즘 시대 없는 가격 ,도봉구
49,카페오븐,서울 도봉구 해등로16길 12 현대아파트상가동 2층 201호,4.3,치즈케이크 팥빙수 팥죽 맛집  시간 이용 제한 있어요  치즈케이크 미쳤음 가격 좀 비싸긴하지만 또 것 같아요  친정 때 카페 최고 존엄 단 팥 라떼 단 팥 생크림 케익 레 어 치즈 케익 다 맛있당    여기 이사 하나 고민 맛 ,도봉구
50,히비끼,서울 도봉구 마들로 664-5 도봉그랜드타워 2층 201호,3.7,모임 장소 늘 집 입니다 맛 양 서비스 모두 모두 훌륭합니다  가격 대비 음식 양 너무  식당 감동 처음 아버님 칠 순 코로나 어디 갈수 없고 여기 룸 있고 또 칠 순 자리 마련 가족 모두 만족했습니다 떡하니 플래카드 음식 좋았는데 사장 님 친절하게 서빙 사진 그걸 또 액자 바로 여기   차 감동 매 회 다 때 쯤 회 케이크 무려 금박 회 여기   차 감동 배 이 것 저 것 마무리 매운탕 글쎄 사장 님 아버님 작은 수 랏 상 여기   차 감동 아버님 굉장히 만족하셨고 저 자식 뭔가 성공 적 식사 자리 마련 한 것 같아 기뻤습니다 장사 이렇게 같아요 준비 배려 덕분 다시 꼭 부모님 주변 추천 저희 마찬가지 입니다 부모님 생신 뜻 깊은 자리 마련 꼭 ,도봉구
51,태림산채정식,서울 도봉구 노해로60길 32,4.2,그저 그랫음 부모님 모시 반찬 많아서         ,도봉구
52,맥반석조개구이,서울 도봉구 도봉로110나길 11,4,    대하 철 대하 간곳 가격 좀 있지만 싱싱하고 맛있음 회로 한 마리 나머진 소 금구 이 추가 조개 수제비 서비스 주변 가격 약간 위 자리는   테이블 다닥다닥 구조 정신 없고 좀 산만함 옆 테이블 비밀 없음 생생한 소통 가능 저녁 시간 가면 웨이팅 있음  대하 구이 기본 수제비 그리고 대하 버터 머리 구이 맛 자체 별 다섯 개 그 이상 웨이 팅 이름 걸 차례 단점 노포 깔끔함과는 거리 있습니다 맛 하나로 다시 방문 생각 있는 곳 입니다 ,도봉구
53,착한전복 창동점,서울 도봉구 해등로 139 상가 1층,3,포장 깔끔하게 잘 너무 맛있아요 반찬 가짓수 많아서 잘      바다 일본 방사 능 오염 해물샤브 코스 요리 주문 가격 많이 비싼 편 주말 맛집 투어 정말 최악 경악 그 자체 양도 적 맛 별로 환경 많이 분하다 돈 은 후회될 정도 코스 요리 샐러드 하 없고 밋 음식 하 없었 다양 너 무적 어 음식 더 달라 하 맛없고 성의 없이 ,도봉구
54,무한리필고기굼터 쌍문점,서울 도봉구 도봉로 499,5,    맛있음  완전 개 친절 맛있고 친절함 무조건 ,도봉구
55,화통소금구이,서울 도봉구 노해로67길 2 한국빌딩 1층,4.3,맛있는데 의자 불편해요    전복   개 씩 곳 맛 서비스 괜찮았음 근처 고 기 집 들 전부   시   분 마감 좋았음  쫄깃 투툼 고기 맛나 집 전복   개 서비스 고기 아주 신선하고 맛나 너무 바빠서 주문 안   밥 먹기 힘들다   ,도봉구
56,쉐프마인드,서울 도봉구 노해로 384,4.1,좋았던 리뷰 완전 맛있어요      가성 비 하타 집집앞 세번 때 후회 내 왜 근처 진짜 돈 없긴 함 ,도봉구
57,오성정육식당,서울 도봉구 도봉로 500 1층,3.3,제 외국 사람 데 육회 비빔밥 한번 본적 없은데 여기 처음 식사 시도 너무 맛있습니다 제 한국어 부족해도 직원 착하고 많이 도 그래서 자주           ,도봉구
58,복진해물잔치마당,서울 도봉구 방학로11길 101,4.2,연포탕 소        가격 많이 연로 부모님 문간 자리 주드 고요 연포탕 하니 선심 안쪽 기분 좋지 낙지 미나리 질 기고 시원한 맛 안나 평점 좋아서 좋은 식사 아니었어요  가격 조금 비싸지만 해물찜 탕 그리고 아귀찜 너무 맛 있어 지역 맛집 입니다     ,도봉구
59,제일곱창,서울 도봉구 노해로65길 7-18 2층,3.8,전골 때문 좋아했던 집 구이 맛있다니 역시 최고      별 하나 아깝다 ,도봉구
60,황금성,서울 도봉구 삼양로 544 2층,3.2,배달 민족 주문 콜라 안 매장 연락 실수 죄송하다 마 디 없고 주소 콜라보 햇 때 주 문 내 역 확인 조차 안 캔 음료     장난 그래도 여자 직원 분 사과 다시 콜라 배달   분 이나 니글니글 맛있게  이 근처 여기 만큼 짜장 맛있게 집 적 없음 다만 짬뽕 다소 짬  막 대단한 맛 아닌데 또 여기 집도 없음 ,도봉구
61,최고집칼국수 방학점,서울 도봉구 방학로 286,2.4,    번 버스 탓   요 바지락 칼국수  본점 매력 맛 양 모두  해물 칼국수   인분     인분 양으로 엄청난 관심 이 지역 맛집 입니다 이번 아침식사 위해 영업 시간 이전 역시 맛 뛰어나기에 아침 항상 많은 사람 ,도봉구
62,이퓨레,서울 도봉구 도봉로169나길 40,4.4,    가성 비 맛집 이 다만 주방 자리 파스타 간 보신 수저 통 다시 또 그냥 보고 비위 좀 그 담 안 있어요 그것 아녔음 자주 방문 같아요  까르보나라 이 물질 ,도봉구
63,인디언소울2,서울 도봉구 도봉산길 12-10,2.4,가지 양념 게장 머리카락 모이 분위기 상 아무 말 안 안 비빔 냉면 미원 범벅 물냉면 그렇고 콩나물 파 희안하고 소 세비       추가   개 위생 맛 최악 고기 다 거기 거기 살짝 비린내 쪼그 다리 쥐남 별 하나 것 아까 움  매우 후회    오후   시 까지 영업 인터넷 맘 예약 전화함 그런데 전화 연결 약      초 동안 응대 없이 본인 들 끼리 대화 함 굉장히 신경질 적 대화 전화 연결 걸 생각 있는데 그 제 짜증 목소리 여보세요 하 심 어찌저찌 예약 뒷 번호      내 전화번호 뒷 자리 그게 아님 아니라고      아니에요 그럼 뭐 분명 수 신기록 왜 넘김   예약 시각   분 정도 일찍 도착 함 인디언 소울   예약 인디언 소울   이 아닌 인디언 소울   로 그런데 밥 도중 전화 왜 예약 시각 안 오냐 주문 취소 고 연락 옴 입 있는 걸 간신히 저희 이미 식사 중 요 이야기 아 인디언 소울   식사 중 그럼 끊음   자리 배정  시 까지만 운영  시간 반 사용 안되고 청소 적어도   분 전 달라 함 이럴 거 왜 전화했을 때 미리 말 안 그때 기분 안 좋음 생각 코로나 인해 정책 때문 것 같기는 한데 그래도 미리 말 좋았을 것 같다는 생각 함 우선   빨리 식사 편이   분 정도 때 마감   분 전 반찬 리 감 술   병 더 시킴 그랬더니  시   분 까지는 야한다며 한번 더 이야기 함 건데 식사 동안 독촉 느낌 계속 시 계보 눈치 결론 불쾌한 식사 점 첫 번째 방문 아니었는데 크게 실망했어요 ,도봉구
