no,name,address,review_star,review_text,gu
988,해성식당,서울 강서구 까치산로 193-13 1층,3.9,이태원 강남 유명한 냉 삼 집 맛 서비스 훨씬 괜찮음 고추장 찌개 먹음 환상 궁합  고기 맛있는데 비싸고 계란찜 위 알 왜 비리 의문 된장찌개 매우 싱겁고요 국수 싱겁고 된장찌개  천원 이면  천원 은 좀 심하네요 고기 만 맛있어요 가격 이 가격 이 안감 무엇 매장 진짜 더러워요 천장 바닥 의자 식탁 심지어 옷 보관 비닐 기름 범벅 정유 소 가도 이 정도 아닐듯 함 모든 사물 모든 면 만 지면 기름 짐  냉삼 맛있음 김치찌개 무도 좋음 ,강서구
989,훈장골 발산점,서울 강서구 공항대로36길 9,3.4,반찬 맛있고고기 맛 일정하고 좋아요  돌솥 밑바닥 뚤려 조각 직원 들 미안해 사장      대 소 롭 응대 밥값 안 식 밥값 다 이렇게 많은 곳 중 주인 정말 없음 돈 좀 아쉬울거 없다 이거지 뚝배기 밑 음식물 끼 세균 엄청    이런 정말 벌금 맛 영업 정지 함 강서 구청 신고 함 참고 주차 직원 없음 자리 널 구석 주차 하 함 짜증나서 왜 이 리가 저리 가라 성질 한번     ,강서구
990,도라무통,서울 강서구 곰달래로 163 1층,3.6,양 진짜 많고 가격 저렴해서 학생 들 가기 좋은 듯 근데 찬양 정도 아닌 맛 카레 맛 나 흔한 즉석 떡볶이 맛  양 많아서 만족    근데 더 많이 주 세 양  양 많음 짬 다 후 갈증 유발 떡볶이 ,강서구
991,호우양꼬치 마곡점,서울 강서구 마곡중앙6로 93 열린프라자 2층,4.1,체인점 그 맛  실패 없는 양 꼬치 집 보임 양념 빼 달라 생으로 주니 참고  특출나지 무난 가기 좋은 곳 입니다 ,강서구
992,메이필드호텔 봉래헌,서울 강서구 방화대로 94 별관 1층,3.8,말 뭐 필요합니까  분위기 다     ,강서구
993,광어포차 금도수산,서울 강서구 화곡로63길 129,2.8,    회 진짜 얇음 한평생 방어 중 최악 그냥 얇다 정도 아님     한 점 덜 주 려고 얇게 수준 임밥 내내 기분 더러 움  때 달라 어느 날 가성 비 좋게 만족하면서 어느 날 읭 정도 심하다 때 있어요 심할 땐 종잇장 마냥 얇고 몇 점안 예전 소라 찜 도 적 있는데 그건 너무 최근 전화 없다하더라구요    ,강서구
994,베이징 화곡본점,서울 강서구 화곡로 118 2층,3.7,바 몇 천원 더 여기  누릉 해물탕 싱거 움 다    전체 적 저 한 탠 금 싱거 움  비싸지만 맛있다 자장 짬뽕 우동 다 맛있다 중국집 우동 포기 이 집 가끔 주인 신지 매우 친절하 심 중국집 이 집 현재 최고 ,강서구
995,경상도집,서울 강서구 강서로45나길 16 송화시장 57호,3.5,주차 시장 주차장 손맛 달짝 지근 물 갈비 분만 추천 대부분 오래된 손님 들 있었음 시 장바닥 노포 인스타 성 오시 안 이 걸 인지 평타 치 안 그럼 염병  돼지 물 갈비  댓글 철 없는 손 들 많아 한마디   년 동네 장사    세 할머니 혼자 운영 어짜피 당일 준비 재료 단골 들 다 소진 손님 안 상관없는 집 우장산역 타지 손님 들 소문 방송 한번 손님 오히려 동 네 단골 들 못 미안해 함 즉 사업 성격 직원 여럿 삐 번쩍 장사 집 비교 서비스 기타 오 바   인분 전체 양 일반인 특히 여자 애 들 정도 일부러 안 같음 ,강서구
996,개화산장,서울 강서구 개화동로19길 6-53,4.5,서울 아닌것 같어 논 두렁 오리 철판 진짜 맛있네 친구 놈 장어 난 오리사 장님 터프 황해 하정우 같네   암튼 갈수 있는 특별한 집  청결함을 원하시면 다른 곳 하지만 맛 그것 극복 정도 맛집 임 다음 우동 사리   압    친절하고 맛있게 ,강서구
1008,황금오리농장,서울 강서구 까치산로 136,2.8,전화 자리 있는지 막상 도착 없다고 안  일 아주 머 님 고객 짜증 부리    테이블 휴대폰 음식 핸드폰 여 기두 어떻게 짜증 짜증    술 취한 손님 들 그러면 상 엎을듯  맛 있는데 돈 기분 ,강서구
1009,사또주먹고기 화곡점,서울 강서구 가로공원로76길 10,4.8,    개인 적 주먹 고기 쫀득 식감 오 겹 살이 더 기본 적 찬 들 괜찮은 편이 식전 계란 스프 고기 좋은 밸런스 좋 은파 상추 갓 깻잎 절임 독특한 간장 소스 등 칭찬 한 만하 그 외 기본 된장찌개 편이 버섯 가지 꽈리 고추가 기본 적 제공 매 뉴 공기밥 주문 밸런스 있게 식사 가능하다 다만 연탄 불 하나 기 화 력 많이 아쉽다 이 부분 개선 좋겠다  사람 많고 사장 직원 진 다 정신 없고 빙글뱅글 환풍기 장식 같고 화장실 옆 건물 있는 고깃집 맛 있음 ,강서구
1010,명품양꼬치,서울 강서구 화곡로 119 2층 202호,4.6,여자 들 끼리 간단히 먹기 괜찮았어요 강서 구청 근처 깔끔한 이자      양 꼬치 오랜 만 기분     친절하시고 가성 비 좋음 ,강서구
1011,푸른농장해바라기 화곡점,서울 강서구 곰달래로 141,3.6, 년 소고기 다 좋음 냉면 글쎄 면 일반 냉면 달라 전 그닥  괜찮아요 사람 많고 시끄러워서 정신 없다는 후딱 것    세상 제일 맛있는 고깃집 집앞 지경 입니다 ,강서구
1012,충북식당,서울 강서구 강서로45가길 9,3.1,친절하고 맛남 한 달 한번 꼭 맛집  제육 찌개 류 다 너무 맛있지만 고객 응대 심각해요  아무리 맛집 해도 너무 너무 불친절합니다   아저씨 묵 뚝뚝 한 거 불친절 다른 거 장사 잘 몇 명 쯤 안   저 그런게 아니지만 밥 너무 불편했네요   저 그만 가야   손님 아저씨 영업   문 앞 팻말 놨자나 거 가세   손님  시간 을 줄 제 뒷 줄 짤린 분 미리 말씀   아까 내 말 못 그만 말 그냥 가세   자기 집 손님 이래저래 미안합니다 다음 입 삦뚤어 지나   밥맛 아쉽네요 ,강서구
1013,신고집해물찜 화곡점,서울 강서구 강서로 188,3.2,지상 최강 제육 건장한 남자 두 명도 배불러서 사장 님 츤데레    재 방문 의사       한 줄평 식당 음식 맛있다면 그 걸 충분하죠 음식 맛       접근성 주차 포함       분위기       가격       친절       청결       코다리 정식 맛있게 간도 적당히 짭쪼롬 조림 메인 무가 일품 입니다 같이 밑반찬 맛있구요 해물찜 점심때 먹기 너무 헤비 다음 해물찜 재 방문 예정 입니다 인테리어 딱 그냥 식당 아주 더럽지도 깨끗하지도 적당한 느낌 입니다 주차 매장 앞 인도 같이 있는 주차 라인 가능한데   개정 가능하구요 그 자리 없으면 근처 주차 여유 있지는 사장 님 그냥 무뚝뚝하셔서 그런지 친절하다고  지인 들 해물찜 쏜다 다 시간 아닌데 해물 코다리 찜 가능하 대서 자리 기도 머 그냥 코다리 찜 먹음 코다리 좋아하긴 해물찜 코다리 찜 기부 니 별로 ,강서구
1014,브런치팩토리,서울 강서구 마곡중앙로 36 마곡엠밸리15단지상가 102호,3.1,맛있  예전 집앞 종종 곳  가성 비 신선도 낮음 커피 보통 ,강서구
1015,메이탄 강서점,서울 강서구 강서로 242 강서힐스테이트상가 215호,3.8,오늘 생일 저녁 리뷰 들 괜찮더니 후기 역시 평점 높지는 정말 안 같네요 테이블 인테리어 브런치 너무 접  맛 누가 맛있다는거지  사장 님 친절하시고 깨끗하고 음식 맛있어요 ,강서구
1016,화곡미담분식,서울 강서구 강서로7길 15 1층,3.1,물가 인상 디저트 백 번 이해 근데 맛 변했습니다 탕수육 주지 짬뽕 맛있게 아니라 그냥 짜장 소스 부족하구요 안 간지   개월 안되서 변했네요  말 필요없다 존맛 탱  떡볶이 꽤 맛있다 좀 더 매웠으면 좋겠다 ,강서구
1017,장어촌민물장어,서울 강서구 강서로52길 34,4.6,주문 아저씨 아줌마 대놓고 손님 말 개무시 곳 개념  진짜 맛있어요 입 살살     ,강서구
1018,원조소금구이,서울 강서구 곰달래로60길 5 1층,4.7,맛있어요  너무 맛있게 기억  이 곳   년 대 중반 제 자주 이용 맛집 요 사장 님 이모 님 친절하시고 연탄구이 맛집 입니다 특히 비 오는 날 친구 연탄구이 소주 한잔 먹기 정말 짱 이구 때 배불러서   기분 좋게 생각 ,강서구
1019,화곡정육식당,서울 강서구 화곡로 132 2층,3.9,난 무조건 삼겹살 내 인생 목살 메뉴 추가 집 숯불 향 육즙 폭발 목살 흰 쌀밥 지금 또  양념 갈비 맛있게 가요     재 방문 의사       한 줄평 화곡 가성 비 끝판 왕 고깃집 음식 맛       접근성 주차 포함       분위기       가격       친절       청결       여자 친구 대판 고기 입 코로 기억 안 하지만 전 맛있게 미국 산이 그런지 가격 대비 양 무지 많습니다 안 다 못   고추 마늘 셀프 코너 없으니 달라 이야기 분위기 매장 시끄러운 편 조용한 분위기 좋아하시는 분 들 싫어하실것 같아요 고기 한우 미국 소 한 돈 있으니 식성 골 것 같아요 ,강서구
1020,소담촌 화곡점,서울 강서구 화곡로 117 1층,2.4,그냥 평범한데 여기 직원 외국인 임 계산 때 손 도안 카드 카드 기름 완전 떡칠 번질번질 거림 개념 없음  위생 뭐 더럽         ,강서구
1021,설화랑 발산역점,서울 강서구 강서로 381-7 예원빌딩 2층,3.6,근처 있어서 방문 빙하 아줌마 음식 팍팍 진짜 기분 나쁩니다 청결 다른 곳 별로  고기 솔직히 기복 있는데 밑반찬 예술 어머니 샐러드   접시     ,강서구
1022,배진수스시,서울 강서구 마곡중앙6로 76-3,3,여기 때 종종 이제 안 같아요 서버 분 실력 차이 요즘   번 가면   번은 오버 쿡 양적 질적 때 아쉬움 처음 정말 괜찮았는데    이제 다른 한우 집 발굴 때  초밥 젓가락 그대로 밥 뭉 쿠우 쿠우 때 이후 처음  자주 곳 위생 아쉬워요 테이블 행주 세척 안된 재사용 연어 알 찌꺼기 식탁 있었고 데스크 하나요 거기 위 컵 수저 곳 자주 안 먼지 접 시위 연어 알   세척 안된 초밥 정리 음식물 밖 두 번   초밥 집 위생 부분 꼭 개선 담 다시 코로나 위생 중요한 시점 이기 이런 관리 라면 한 동안 안 같아요 맛 나쁘지 ,강서구
1023,구구향훠궈 마곡나루역점,서울 강서구 마곡중앙로 171 마곡나루역프라이빗타워2 1층,4.8,가게 일 층 조그만데 배민 배달 후 첨 방문 약간 웨이 팅 한두 팀 커플 세트 저 흰     셋트 시킴 주방 네 분 열심히 초밥 깔끔하고 좋았어요  종종 부모님 모시 한번 정도 깔끔함 재료 통 물이 상 맑고 깨끗해서 너무 맘 사장 님 이모 님 너무 다 친절하셔서 가분 좋아요    점   점 아쉽네요     ,강서구
1024,옛날한우곱창전문 본점,서울 강서구 공항대로59길 32,3.2,서울 식물원 근처 맛집 검색 후기 좋길래 정말 곳 중 야채 다른 재료 들 가장 신선하고 맛있더라구요 심지어 훠궈 안 좋아하는 우리 아가 들 이 날 너무 잘 못 알 바 로우 사골 육수 맛있었는지 훠궈 더 잘 물론 바로 우도 맛있지만 세 가지 맛 다양하게 수 있는 훠궈 강추 입니다   사진 다 사진 없어서  주문 대답 안해 주인 장 돈 많이 나부 오늘이 마지막 기분 더럽네  개 기고 그냥 쌍욕   인분      원 차라리 삼각김밥 모금 함 하 ,강서구
1025,선식당,서울 강서구 방화대로34길 96 낙원빌딩 1층,3.3,맛 없고 곱창 질겨 고무줄 느낌 비싸고 불친절 이집 맛집 이유 긍금  쌀국수 바 로우     ,강서구
1026,거궁 마곡점,서울 강서구 공항대로 236 쿠쿠빌딩 3층,2.1,쌀국수 오늘 운 없는 날 생각 가지  음식 맛있는건 극 소수 멋 없는 더 천 지 임 가격 무슨       원 양심 없는 가게 심지어 불친절 룸 아니면 시끄러 움 속 안좋음 고기 좋아하는 사람 들 좋음   점도 아까 움 가나  음식 맛 좋으나 직원 들 불친절합니다  시   분 부터 영업 종료 정리 몇번 씩 얘기 당황 영업 시간  시   분 으로 기재 ,강서구
1027,여가반상,서울 강서구 마곡중앙6로 85 마곡사이언스파크뷰 2층,3.9,우선 다 사진 민망합니다 단언 컨데 마곡지구 이렇게 좋은 가격 맛 반찬 한정식 곳 없습니다 밥 최고 고요 요즘 외식 비 어마어마하게 더 삼겹살     그람      원 시대 여기 기본 상 이인 분 비교 안됩니다 사장 님 뭘 돈버시 정도 네 또 방문 잘 주차 편하고 자리 널찍해서 좋습니다 다른 리뷰 보고 걱정 방문 번창      별 점 테러 인간 들 다른 가게 들     가까이 악플 한가해 보 부럽다고 살 분들 기운 장난 질 제발 삼 ,강서구
1028,인라이크,서울 강서구 양천로30길 103 화성빌딩 1층 103호,4.7,돈쭐 프로 보고 별 점 테러 인간 있네요 요즘 또 라이 들 얼마나 많은데 상상 초월 하 주문 당연히 확인 또 확인 정상 그리고 자 영업 분 들 먹방 안 먹방러 직접 한번 하루 종일 장사 다른데 신경 겨를 없음 세상 물정 사람 들 많음  조용한 동네 카페 커피 맛있구요 케이크 수 제 케이크 맛 나용  아이디 어스 보고 카톡 문의 남자친구 생일 케이크 예약 밀가루 안 퍽퍽 생각 정말 정말 맛있었습니다 다만 크림 좀 느끼해서 많이 단점 흑임자 러버 로써 최고 흑임자 케이크 레터 링 예쁘고 다음 번 기회 또 멀어서 아쉬울 뿐 ,강서구
1029,웜테이블,서울 강서구 공항대로49길 5-17,4.1,마곡 카맵 평점 보고 일부러 레몬 케이크      원 쑥 케이크      원 포장 달 좋았어요 폭 신한 아티 제 스타일 생크림 케이크 익숙해 그런지 막 너무 맛있단 생각 안 그렇다고 맛 없지도 나중 또 보고  경상도 버섯 크림 리조토 라자냐 약간 매운 파스타 이름 기억 안남 맛 특별하진 그 외 서비스 분위 다 만족스럽고 가격 적 부분 크게 부담  버섯 크림 리조또 정말 맛있어요 ,강서구
1030,차돌집,서울 강서구 방화대로21길 85,3.6,라자냐 맛있어요 리조또 봉골레 참나물 파스타 등 괜찮았습니다 스테이크 평범하네요  얇은 차돌 그만 두 툼 차돌 원하는 자 차돌 집 오라  오래된 분위기 좋아요 맛 전체 적 좋습니다 다만 깨끗하지    ,강서구
1031,사쿠라테이엔 마곡나루점,서울 강서구 마곡중앙로 161-8 두산더랜드파크 B동 1층 115호,3.2,    그냥 저녁 시간대 일단 직원 분들 친절하셔서 약간 놀램 사시미 비쥬 얼 두 번 놀램 진짜 괜찮은 듯  리뷰 보고 반신반의 딱 새우 너무 걱정 달리 딱 새우 모듬회 너무 맛있었어요 리뷰 평점 왜    이자카야 이정 퀄리티 가격 이면 저 라면 용    분위기 너무 좋아서 벚꽃 밑 인생샷 지인 들 좋은 시간 네 용     아 사장 님 서비스 너무 잘 히 히 ,강서구
1032,평양냉면 대동관 강서점,서울 강서구 우장산로 120 1,3.5,가격 사악 데코 좋아요 딱 새우 초저녁 마감 모듬 다섯 마리 회도 다섯 등등  만원 보시 판단 메뉴판 딱 새우     서울 다른데     입니다           ,강서구
1033,김가네설렁탕,서울 강서구 방화동로 52,2.2,      만원 먹고 주 차비      안  자주 김 네 설렁탕 도가니탕 파리 있었네 그냥 일 반 설렁탕 도가니탕 돌솥밥값  천원 이 젠 못 ,강서구
1034,화로구이,서울 강서구 강서로 374,2.5,별   개 최악 음식 벌레 거 처음 포장 주문 벌레 마리 둥둥 위생 빵점 곳 가지    별 기준 참고     개 최고 주변 입 소문 낼 정도 재 방문 의사 있음 맛집 추천 멀어도 일부러 정도   개 좋음 그래도 이 정도 정도 재 방문 의사 있음 맛집 추천   개 보통 그냥 주변 있을 때 번 만하   개 별로 주변 있어도 안 감   개 나쁨 욕   개 최악 쌍욕  비싸긴하지만 정육 식당 맛있음 다만 테이블 수 대비 직원 부족한듯     ,강서구
1035,하영족발과보쌈,서울 강서구 화곡로61길 100 1층,4.7,여기 식당 사장 아들 아주 무 개념 예의 없음 고기 가격 비쌈 갈비탕 고기 질 고기 같습니다 보고      족발 완전 야들야들하고 맛있어요 사장 님 친절 꼭        배민 리뷰 여기 일부러 리뷰 ,강서구
1036,케렌시아,서울 강서구 마곡서로 152 두산더랜드타워 B동 2층 219~220호,3.8,족발 보쌈 막국수 사장 님 너무 친절하시고 맛있었어요 바쁘셔서 막국수 사골 국도 주시 너무 감동 족발 입 밑반찬 들 예술 입니다 또 참고 이사 이 주소 아닌 것 같습니다 오정동        욥  점심식사 가격 저렴해서 기대 안 정말 맛있고 퀄리티 말 안 정도 좋아요 너무 만족스러운 식사 명란 크림 파스타 정말 맛있었어요 다음 재 방문     점심 리조또 파스타 샐러드 메뉴 각각     원 씩 할인 너무 좋은 것 같아요 크림 파스타  네이버 가게 앞 야하는거 아닌가요   분 갑자기 가게 날 말    그렇게 책임감 없이 장사 ,강서구
1037,소담촌 마곡점,서울 강서구 마곡중앙6로 93 열린프라자 4층 403호,3,    죽 싹싹 열무김치 맛있고 좋네요     ,강서구
1038,교대이층집 발산점,서울 강서구 강서로 381 수창빌딩 2층,4,있는데 사람 언넝 얘기 진짜 기분 안좋네요 더구나 저희    명 정도 단체 저희 다른 테이블 인원 식사 도중 이렇게 식사 도중 식당 평생 처음  깔끔하고 좋습니다 설명 친절하게 시간 그런지 마지막 아이스크림 수 있도록 설치 기 계덕 분 좋은 마무리 수 있습니다     ,강서구
1039,감성9091돼지 강서직영점,서울 강서구 공항대로 345 2층,3.1,사실     그램     면 저렴한 고기 아니다 하지만 넓 직한 가게 가게 분위기 그리고 대신 고기 먹기 편한 점 기억 고기 맛 그냥 가격 나타남  고기 괜찮은데 직원 수가 너무 말 안되게 벨 세 번 번 옴 주문 벨 세 번불 달라 벨 세 번불 불 판이 안 또 벨 세번 직원 들 계속 안쓰럽고 환기 안되는지 매장 전체 뿌옇고 사장 마인드 단단히 잘 못     번 이상 간 듯 고기 양념 깔끔한 편이 기름 맛 물 좋고요 샐러드 야채 늘 상태 좋고 가격 무난 양념 돼지갈비 ,강서구
1040,백두한우곱창전문,서울 강서구 공항대로 291 등촌동성원상떼뷰오피스텔 1층,3.5,소고기 가격 돼지고기 맛 볼 수 있는 곳  항상 맛집 입니다 다른 곳 곱창 맛 있고 양도 적당한 거 같습니다 다만 곱창 곱 없어서 여자친구 싫어하는데 대창 막창 맛있어서 전 좋아해요  친절하고 맛있습니다 맛있게 ,강서구
1041,빵쌤 마곡점,서울 강서구 마곡중앙로 59-5 1층,3.2,곱창 통통하고 곱 많아요 맛있어요 볶음밥 맛없어요 싱거워서   간이 너무 안된듯  소금 빵 안 버터 햄 빵 혹시 직원 분 저희 그냥 아무 것 안 소금 빵 안 요 팥 버터 소금 빵 있던데 그럼 그건 뭔가 다른 직원 분 보 시기 무조건 없다고만 당황 그래도 옆 다른 직원 분 다 말씀 아쉽지만 다른 빵 구매    직원 분들 친절하고 분위기 괜찮습니다 의자 좀 더러워요 아메리카노 고소한 맛 주문 쓴맛 강합니다 바스크 치즈케이크 종이 두 장 주의 좀더 단단한 파리바게트 치즈 케익 맛 다른 바스크 치즈케이크 덜 덕 것 같습니다 크기 작진 가성 괜찮다고 생각 블루베리 타르트 시트 많아서 조화롭지는 맛 입니다 블루베리 싱싱해서 톡톡 식감 좋았습니다 에그타르트 에그타르트 중 최악 타르트 딱딱한데 눅눅하고 풍 미도 거의 없다고 수 있습니다 계란 맛 커스타드 바닐라 에센스 같은 맛 강하고 위 젤라틴 식감 맛 방해 것 같습니다 초코 타르트 영등포 점 무스 흐물흐물 에그타르트 마찬가지 타르트 생각 이상 별로 무스 쌉싸름하고 호두 베리 상큼 함 더해져서 질리 맛 ,강서구
1042,스타벅스 화곡DT점,서울 강서구 등촌로 57,3.4,빵 그럭저럭 커피 개인 취향 별루 가격 비싸요  개선 굿  위치 좋아서 종종 ,강서구
1043,헬로비에트,서울 강서구 화곡로25길 25 1층,4.5,        골목 안쪽 위치 가게 매우 협소 자리 매우 협소 쌀국수 뜨끈하게 좋았음 맛 살짝 간이 밍밍 하나 소스 먹기 굳 쌀국수 숙주 리필 이집 매력      원 에서 더 이상 금액 안 직원 분 친절     점 만점      점 ,강서구
1044,주엔,서울 강서구 마곡중앙6로 40 JH장흥빌딩 2층,3.6,쌀국수 국물 훌륭하고 분 새 콤 맛있었습니다  맛 좋지만 맛 좋습니다   시 에 마감 브레이크 타임 왜  시 라고 어이없네 ,강서구
1045,강릉엄지네꼬막집 발산점,서울 강서구 공항대로 291 성원오피스텔 210,3.6,짜장 되게 제 평소 좀 싱겁게 한데 간이 전반 적 쎄요 근데 맛 없는건 아니라 별 세 개 다시 볶음밥 안 용         ,강서구
1046,돈오야 까치산역본점,서울 강서구 강서로 55,4.1,    가성 비충 들 가세 가격 보시 고 기질  돼지고기 프리미엄 가게   인분 가격   인분 있다는 장점 있지만 때 맛있다가 아닌 그냥 고기 오징어 맛있다하만 그냥 오징어 식감 소스 맛 끝 맛없는거는 아니지만 그냥   인분 기준 만원 더 프리미엄 집 ,강서구
1047,등촌샤브칼국수 등촌점,서울 강서구 강서로56가길 65,4.4,        안 맛 매장 넓고 친절하세요 주차 조금 협소합니 ,강서구
1048,맹순이꽃게아구전문점,서울 강서구 공항대로 272 하바나빌딩 2층 -주차장 건물 뒷편-,3.2,등촌 샤브 칼국수 정말 좋아하는데 구로 시흥 여러 군데 많이 여기 제일 맛 없네요     신선하지 다  음식 주차 안내 아저씨 정말 싸가지 없네요 말 막 말좀 막 이뿌게 하라 머 하니 그때 정말 기분 잡 음식 또한 별로 네 방문 절때  너무 비쌈 블로거 많이 그런데 넓어서 회식 좋음 솔직히 맛 있었음 그런데 정말 가격 맛있는 생각 다른 가성 비 있는 집 게 좋을듯 돈 많고 찾기 귀찮으면 괜찮은 집임 ,강서구
1049,춘천무쇠닭갈비 까치산역점,서울 강서구 곰달래로 147-1,3.1,최악 찜집  친절하고 맛있어요  사람 많길래 정말 실망 스럽네요 우선 위생 안좋아요 맨손 모든 걸 다 네 명   인분 닭고기 다 한 마리 안 것 같은 정말 양 거의 야채 뿐 닭갈비 야채 볶음 간 양념 맛 없고 기만 너무 매워서 바로 배탈 그리고 사장 님 너무 불친절하시네요 저희 삼 인분   인분 우동 사리 고구마 사리 근데 고구마 양은 그대로 것 같고 우동 한참 안 닭고기 직전 안 그냥 취소 그 제 절반 닭갈비 위 뿌리 우동 사리 양념 없이 싱겁게 맛 없이 돈 정말 아깝네요 지금 닭갈비 중 제일 맛 없었어요 ,강서구
1050,스타벅스 마곡나루,서울 강서구 마곡중앙로 161-17,4.1,쯔양 곳 방문 대박 엄청 맛있어 이런 느낌 아님 그냥 다 무난 맛있었음 감칠맛 딱히 있진 그냥 평범한 양념 물리 계속 그런 맛임  친절하 심       시   분 타임 근무 남자 직원 분 정말 친절하세요 ,강서구
1051,달인대보손칼국수,서울 강서구 마곡중앙5로 6 마곡나루역보타닉푸르지오시티 2층 211호,4,    맛있다고 솔직히 소 소 특히 사람 많은 점심 시간 칼국수 거의 상태     ,강서구
1052,그랑한우 마곡점,서울 강서구 마곡중앙6로 66 퀸즈파크텐 2층 220호,4.7,한때 너무 맛 변해서 한동안 안 사장 님 다시 가성 역시 굿굿 김치  높으신 분 모시 급하게 당일 예약 눈치 껏 안내 밥 맛있게 추천  냐암냐암냠 ,강서구
1053,대왕곱창구이,서울 강서구 강서로 22,3,점원 친절해요 고기 부드러워요  선지국 바퀴벌레  양도 진짜    염통 손 판 거 감자 위 판위 있는거 먼저 소리 그거 그래서 뜨거운 걸 못 뜨거운거 소리 왜 ,강서구
1054,마곡삼계탕,서울 강서구 공항대로 247 퀸즈파크나인 2층 234~238호,4.1,맛 그냥 그냥 괜찮은 편 몇개 월 사이 가격   번 반찬   개 가격 때문 이제 안 고함 그냥 곱창   인분 볶음밥   개 소주        원 나왔음 예전 손님 가격 이렇게 많이 올 리지 차라리 손님 많은게 좋은 거 아닌가         ,강서구
1055,이가네양갈비양꼬치,서울 강서구 마곡동로 62 마곡사이언스타워 2층 209호,4.5,맛 별로 직원 불친절 홀 넓어서 회식 좋아 보임  친목 모임 양 꼬치 양 갈비 구이 맛 없는 메뉴 없음 그냥 최고  냄새 안나 제 양 꼬치 중 젤 맛있었어요 사장 님 친절하세요 ,강서구
